title,time,details
Searched for captain marvel,2019-03-08T09:01:17.297Z,
Searched for stand-up comedy,2019-03-07T17:56:46.140Z,
Searched for standup,2019-03-07T17:27:17.577Z,
Searched for savage,2019-03-07T09:36:35.559Z,
Searched for gon hunter rising music,2019-03-06T15:39:20.124Z,
Searched for gon rising music,2019-03-06T15:39:08.561Z,
Searched for gon rising,2019-03-06T15:38:59.346Z,
Searched for kunal kamra,2019-03-06T10:33:55.313Z,
Searched for kanhaiya kumar,2019-03-05T15:44:31.363Z,
Searched for meruem after,2019-03-05T12:37:06.868Z,
Searched for merium after,2019-03-05T12:36:48.153Z,
Searched for killua vs shoot,2019-03-05T11:43:53.027Z,
Searched for kunal kamra,2019-03-05T08:47:51.224Z,
Searched for hanna stocking music,2019-03-04T13:30:17.073Z,
Searched for alluka,2019-03-04T12:31:07.409Z,
Searched for kunal,2019-03-04T09:41:32.613Z,
Searched for ted,2019-03-04T04:09:41.381Z,
Searched for bodhisattva real story,2019-03-03T16:58:21.376Z,
Searched for bodhisattva story,2019-03-03T16:58:05.382Z,
Searched for Bodhisattva!,2019-03-03T16:57:19.416Z,
Searched for golden 100 hands,2019-03-03T16:54:27.481Z,
Searched for news,2019-03-02T15:01:46.520Z,
Searched for 20 min body workout,2019-03-02T09:31:55.999Z,
Searched for duke side stand sensor,2019-03-02T08:02:28.013Z,
Searched for how to remove duke stand sensor wire,2019-03-02T06:57:05.932Z,
Searched for gon goes to kukuroo mountain,2019-03-02T05:04:30.163Z,
Searched for gon take back his eyes,2019-03-02T04:37:01.276Z,
Searched for naunika saves gon,2019-03-02T04:26:34.858Z,
Searched for how to make paneer,2019-03-02T03:20:20.954Z,
Searched for abhinandan latest video,2019-03-02T02:58:38.791Z,
Searched for abhinandan,2019-03-02T02:58:01.648Z,
Searched for abinandan,2019-03-02T02:57:03.348Z,
Searched for gon vs bomber,2019-03-01T17:06:35.207Z,
Searched for #Hannah,2019-03-01T15:22:20.759Z,
Searched for knuckles ability,2019-03-01T15:06:59.043Z,
Searched for duke side stand sensor,2019-03-01T14:31:14.266Z,
Searched for duke side stand sensor,2019-03-01T09:56:21.752Z,
Searched for duke side stand sensor,2019-03-01T09:23:36.459Z,
Searched for cardiovascular exercise,2019-02-28T15:30:43.469Z,
Searched for cardiovascular,2019-02-28T15:26:40.916Z,
Searched for hunter x hunter gon rising music,2019-02-27T17:22:57.636Z,
Searched for hunter x hunter rising music,2019-02-27T17:22:32.787Z,
Searched for oneplus 5 update,2019-02-27T13:53:49.851Z,
Searched for onelus 5 update,2019-02-27T13:53:36.762Z,
Searched for onelus 5,2019-02-27T13:53:30.898Z,
Searched for girlfriend song,2019-02-26T15:35:18.989Z,
Searched for https://youtu.be/P5eXBTniE8o,2019-02-26T15:25:23.941Z,
Searched for tu long mai lachi,2019-02-26T15:25:17.670Z,
Searched for tu long mai lachi,2019-02-26T14:41:18.733Z,
Searched for gon vs netero,2019-02-26T14:09:30.799Z,
Searched for gon vs pitou,2019-02-24T16:27:08.444Z,
Searched for naruto vs pain,2019-02-24T15:53:06.689Z,
Searched for dilko tumse pyar hua indian idol season 10,2019-02-23T16:37:47.655Z,
Searched for dilko tumse pyar hua,2019-02-23T16:37:22.538Z,
Searched for kuch bhi mehta,2019-02-23T16:03:13.817Z,
Searched for kuch bhi,2019-02-23T16:02:26.987Z,
Searched for hunter x hunter volleyball game full,2019-02-23T12:55:51.448Z,
Searched for hunter x hunter rising music,2019-02-23T12:55:40.668Z,
Searched for kuch bhi mehta,2019-02-22T17:32:19.578Z,
Searched for standup,2019-02-22T14:51:32.358Z,
Searched for kunal kamra,2019-02-22T13:06:31.286Z,
Searched for giraftar,2019-02-21T06:57:22.230Z,
Searched for raftar,2019-02-21T06:53:17.261Z,
Searched for interstellar,2019-02-20T18:24:32.306Z,
Searched for dil hai chota sa full song,2019-02-20T17:43:06.574Z,
Searched for bantai,2019-02-20T17:09:55.960Z,
Searched for naezy,2019-02-20T16:58:53.768Z,
Searched for naezy rapper,2019-02-20T16:58:46.830Z,
Searched for naizi rapper,2019-02-20T16:58:37.882Z,
Searched for naizi,2019-02-20T16:58:32.596Z,
Searched for naixi,2019-02-20T16:58:27.461Z,
Searched for nazi,2019-02-20T16:58:19.877Z,
Searched for bahut hard,2019-02-20T16:42:52Z,
Searched for bahut,2019-02-20T16:42:46.192Z,
Searched for standup,2019-02-20T15:42:15.211Z,
Searched for my hero academia raid,2019-02-19T18:23:44.968Z,
Searched for my hero academia raid,2019-02-19T14:54:39.439Z,
Searched for how to increase acceleration of activa,2019-02-19T10:00:51.807Z,
Searched for seeker plus,2019-02-19T08:54:17.477Z,
Searched for seeker,2019-02-19T08:54:08.553Z,
Searched for gully boy,2019-02-19T06:41:00.661Z,
Searched for gully boy songs,2019-02-19T06:37:55.606Z,
Searched for bahut hard song,2019-02-19T06:27:02.958Z,
Searched for goriye,2019-02-19T06:25:27.672Z,
Searched for kaam bhari,2019-02-19T06:14:29.059Z,
Searched for azadi kunal kamra,2019-02-19T06:12:23.140Z,
Searched for azadi,2019-02-19T06:08:00.798Z,
Searched for mad max soundtrack,2019-02-19T05:13:37.629Z,
Searched for psychology,2019-02-18T13:00:37.095Z,
Searched for how does sun,2019-02-18T12:59:13.236Z,
Searched for how does sun,2019-02-18T07:50:33.558Z,
Searched for matter 1 seeker,2019-02-18T06:56:24.152Z,
Searched for matter 1,2019-02-18T06:56:18.897Z,
Searched for matter,2019-02-18T06:56:11.964Z,
Searched for nuclear fusion,2019-02-18T05:33:25.877Z,
Searched for nuclear fussion,2019-02-18T05:33:22.601Z,
Searched for nuclear fission,2019-02-18T05:29:33.251Z,
Searched for how to find age of fossils,2019-02-18T04:19:55.386Z,
Searched for how to find age,2019-02-18T04:19:35.400Z,
Searched for mad max soundtrack,2019-02-17T18:59:40.038Z,
Searched for my hero academia music,2019-02-17T18:54:19.646Z,
Searched for my hero academia,2019-02-17T18:54:10.578Z,
Searched for mari music,2019-02-17T18:44:29.111Z,
Searched for mari,2019-02-17T18:43:41.585Z,
Searched for my hero academia rising music,2019-02-17T18:30:34.889Z,
Searched for ted riddle,2019-02-17T16:21:09.984Z,
Searched for riddle,2019-02-17T16:15:01.221Z,
Searched for interstellar music,2019-02-17T14:40:56.466Z,
Searched for interstellar docking,2019-02-17T14:40:49.363Z,
Searched for almight,2019-02-16T05:54:45.228Z,
Searched for my hero academia,2019-02-16T05:54:39.379Z,
Searched for interstellar docking,2019-02-16T05:30:26.943Z,
Searched for theory of relativity,2019-02-16T05:27:38.740Z,
Searched for my hero academia best climax,2019-02-16T05:23:45.518Z,
Searched for midoriya vs todoroki,2019-02-15T09:56:46.780Z,
Searched for flacon f9,2019-02-15T06:35:52.402Z,
Searched for interstellar,2019-02-15T05:55:03.207Z,
Searched for theory of relativity,2019-02-14T04:33:06.672Z,
Searched for relatity,2019-02-14T04:32:52.566Z,
Searched for relatively,2019-02-14T04:32:46.547Z,
Searched for ashish chanchlani,2019-02-13T15:48:58.594Z,
Searched for jet engine,2019-02-13T05:54:05.165Z,
Searched for mad max soundtrack,2019-02-12T12:50:07.478Z,
Searched for madmax,2019-02-12T12:48:43.825Z,
Searched for how to dye clothes at home,2019-02-12T09:35:08.230Z,
Searched for ganja ganja,2019-02-11T15:04:11.530Z,
Searched for laga laga re laga prem rog,2019-02-11T14:15:57.101Z,
Searched for dust ai,2019-02-11T13:19:46.028Z,
Searched for apex,2019-02-10T18:12:10.391Z,
Searched for apes,2019-02-10T18:12:05.829Z,
Searched for my hero academia,2019-02-10T07:55:44.439Z,
Searched for cinematic,2019-02-09T15:18:14.945Z,
Searched for genius einstein episode 2 in hindi,2019-02-09T06:25:47.689Z,
Searched for oneplus 5 rom,2019-02-07T15:32:16.653Z,
Searched for OnePlus 5,2019-02-07T15:31:24.364Z,
Searched for pubg India,2019-02-06T17:15:59.450Z,
Searched for pubg,2019-02-06T17:15:42.284Z,
Searched for alita,2019-02-05T17:47:20.183Z,
Searched for game theory,2019-02-05T16:54:06.177Z,
Searched for riddick,2019-02-05T04:19:30.231Z,
Searched for self discipline,2019-02-02T18:25:11.790Z,
Searched for self discipline,2019-02-02T12:54:10.425Z,
Searched for bahut hard song,2019-02-02T07:10:42.260Z,
Searched for jerryrigeverything m20,2019-02-02T05:55:00.528Z,
Searched for jerryrigeverything,2019-02-02T05:54:55.418Z,
Searched for aeroplane on aeroplane,2019-02-02T05:22:37.904Z,
Searched for alita,2019-02-01T16:43:46.459Z,
Searched for jnu kunal kamra,2019-02-01T11:50:10.312Z,
Searched for jnu,2019-02-01T11:49:59.538Z,
Searched for kunal kamra,2019-02-01T11:49:45.421Z,
Searched for mini 14 sound,2019-02-01T11:41:05.861Z,
Searched for mini 14,2019-02-01T11:39:48.963Z,
Searched for afreen afreen and me,2019-02-01T11:17:10.398Z,
Searched for ham kale he to kya hua dilwale he dj,2019-02-01T11:16:39.950Z,
Searched for pal,2019-02-01T11:15:03.193Z,
Searched for mera man,2019-02-01T11:05:03.940Z,
Searched for kash,2019-02-01T11:04:47.544Z,
Searched for alita,2019-02-01T10:50:57.956Z,
Searched for alita,2019-02-01T10:02:39.540Z,
Searched for corporate job and motivation,2019-01-30T15:38:11.581Z,
Searched for kiasi teri khudgarzi mashup,2019-01-30T15:27:57.929Z,
Searched for kaisi teri khudgarzi,2019-01-30T15:27:51.138Z,
Searched for kiasi teri khudgarzi,2019-01-30T15:27:41.357Z,
Searched for mashup,2019-01-30T15:26:57.607Z,
Searched for oxy vs soul,2019-01-30T06:46:26.003Z,
Searched for oxy vs soul,2019-01-30T05:35:26.445Z,
Searched for oxy,2019-01-30T05:35:12.594Z,
Searched for how does submarine work,2019-01-29T19:58:02.873Z,
Searched for how does suarine work,2019-01-29T19:57:55.273Z,
Searched for #LaughsTV,2019-01-29T19:48:07.029Z,
Searched for mostlysane,2019-01-29T14:16:10.295Z,
Searched for apna time aayega,2019-01-29T04:30:34.112Z,
Searched for how does rocket guide,2019-01-27T07:56:47.640Z,
Searched for how does spaceship launcher guide,2019-01-27T07:53:05.351Z,
Searched for how does falcon guide,2019-01-27T07:52:46.455Z,
Searched for how does falcan guide,2019-01-27T07:52:38.955Z,
Searched for how does a rocket engine guide,2019-01-27T06:04:47.765Z,
Searched for naruto vs sasuke,2019-01-27T04:55:49.937Z,
Searched for standup,2019-01-26T18:18:53.536Z,
Searched for apna time aayega,2019-01-26T18:09:01.518Z,
Searched for bahut hard song,2019-01-26T17:47:46.073Z,
Searched for bahut,2019-01-26T17:47:39.049Z,
Searched for how missile engine works,2019-01-26T12:24:50.781Z,
Searched for missile engine,2019-01-26T12:00:10.092Z,
Searched for missile flight,2019-01-26T11:56:20.098Z,
Searched for bhabhi,2019-01-25T19:01:43.902Z,
Searched for #TheGamersToysLive,2019-01-24T04:13:55.114Z,
Searched for variable compression engine,2019-01-23T12:26:12.676Z,
Searched for mad max music,2019-01-22T15:36:22.841Z,
Searched for interstellar soundtrack,2019-01-22T15:32:45.391Z,
Searched for interstellar,2019-01-22T15:32:40.622Z,
Searched for how to check a psu with a multimeter,2019-01-21T06:16:22.950Z,
Searched for how does a plane engine work,2019-01-21T03:57:57.294Z,
Searched for oneplus 5 update,2019-01-20T18:12:44.705Z,
Searched for oneplus 5,2019-01-20T18:11:10.263Z,
Searched for friends,2019-01-19T04:38:59.418Z,
Searched for indian national anthem,2019-01-15T14:35:35.343Z,
Searched for vande mataram lata,2019-01-15T14:25:31.443Z,
Searched for dance on rang de basanti for boys,2019-01-15T13:56:28.724Z,
Searched for dance on rang de basanti,2019-01-15T13:56:03.884Z,
Searched for school dance on rang de basanti,2019-01-15T13:47:55.566Z,
Searched for rang de basanti songs,2019-01-15T13:46:53.622Z,
Searched for storytelling,2019-01-14T19:16:29.768Z,
Searched for 120,2019-01-14T19:12:52.104Z,
Searched for standup,2019-01-14T18:58:45.560Z,
Searched for allah ke bande,2019-01-14T16:56:23.513Z,
Searched for Jack Reacher,2019-01-13T11:50:56.291Z,
Searched for standup,2019-01-12T18:48:42.884Z,
Searched for riddle,2019-01-11T19:37:16.008Z,
Searched for riddle,2019-01-11T19:04:01.827Z,
Searched for pubg interview in india,2019-01-11T18:10:00.200Z,
Searched for pubg in india,2019-01-11T18:09:36.204Z,
Searched for pubg,2019-01-11T18:09:22.274Z,
Searched for hayat and murad,2019-01-11T12:14:10.042Z,
Searched for asli,2019-01-11T12:13:01.213Z,
Searched for asli moments,2019-01-11T11:43:51.552Z,
Searched for asli ferhat moments,2019-01-11T11:43:44.075Z,
Searched for temple riddle,2019-01-11T04:54:46.502Z,
Searched for breakup raghvan kohli,2019-01-10T10:28:13.173Z,
Searched for breakuo ragvhan kholi,2019-01-10T10:28:09.716Z,
Searched for ragvhan,2019-01-10T10:27:57.950Z,
Searched for riddle,2019-01-09T17:59:19.272Z,
Searched for samsung waterproof phone,2019-01-09T14:18:26.334Z,
Searched for ip68,2019-01-09T14:18:09.533Z,
Searched for dynamo pubg,2019-01-08T04:39:54.737Z,
Searched for dynamo best,2019-01-08T04:37:41.730Z,
Searched for pubg,2019-01-08T04:30:16.372Z,
Searched for kickass moments,2019-01-05T15:51:33.198Z,
Searched for gully boy trailer,2019-01-04T19:15:35.662Z,
Searched for app ke aa janese,2019-01-04T10:00:24.156Z,
Searched for writing machine,2019-01-04T06:09:31.258Z,
Searched for afreen afreen,2019-01-04T05:07:30.181Z,
Searched for Canvas Laugh Club,2019-01-03T18:39:28.544Z,
Searched for ted,2019-01-03T17:07:27.937Z,
Searched for mad Max music,2019-01-03T15:35:29.073Z,
Searched for mini 14 sound,2019-01-03T15:12:27.696Z,
Searched for mini 14,2019-01-03T15:12:19.182Z,
Searched for corporate job and motivation,2019-01-03T10:48:47.637Z,
Searched for kya wo pyar tha,2019-01-03T10:34:33.891Z,
Searched for kya hua yaar na,2019-01-03T10:34:26.571Z,
Searched for how to make adrak lassun vinegar,2019-01-02T16:16:18.543Z,
Searched for kya wo pyar tha,2019-01-02T15:20:55.317Z,
Searched for kunal kamra,2019-01-02T14:40:12.818Z,
Searched for standup,2019-01-02T14:36:02.188Z,
Searched for hrx shoes review,2019-01-02T14:34:41.935Z,
Searched for find x,2019-01-02T06:35:39.304Z,
Searched for oneplus 5,2019-01-01T07:58:03.890Z,
Searched for jolly setia,2019-01-01T05:20:32.380Z,
Searched for jeet,2019-01-01T05:05:10.154Z,
Searched for end of the batman,2019-01-01T04:50:50.691Z,
Searched for the living legend part 2,2019-01-01T04:50:34.545Z,
Searched for the living legend,2019-01-01T04:50:21.208Z,
Searched for thackeray movie trailer,2019-01-01T04:06:10.040Z,
Searched for simon sinek,2019-01-01T04:00:17.287Z,
Searched for simon sinek,2018-12-31T19:03:47.121Z,
Searched for how to remove fish bone,2018-12-31T04:21:00.963Z,
Searched for how to remove,2018-12-31T04:20:44.999Z,
Searched for oneplus 5,2018-12-31T03:00:53.050Z,
Searched for chogada tara,2018-12-30T14:47:24.080Z,
Searched for ultimate,2018-12-30T14:46:53.653Z,
Searched for hrx shoes review,2018-12-30T07:21:33.279Z,
Searched for hrx,2018-12-30T07:15:26.008Z,
Searched for storytelling,2018-12-29T18:11:57.550Z,
Searched for mumbaiker nikhil,2018-12-29T05:18:56.057Z,
Searched for standup,2018-12-28T18:00:32.236Z,
Searched for standup,2018-12-28T11:24:25.097Z,
Searched for ben ultimate vs kevin,2018-12-26T14:33:10.085Z,
Searched for standup,2018-12-24T13:22:45.077Z,
Searched for Sherlock best,2018-12-21T17:12:31.311Z,
Searched for winter soldier starting,2018-12-19T15:53:43.941Z,
Searched for winter soilder starting,2018-12-19T15:53:26.445Z,
Searched for nick fury shows captain,2018-12-19T15:52:57.171Z,
Searched for captain america lift hellicarier,2018-12-19T15:52:24.820Z,
Searched for captain america lift,2018-12-19T15:51:49.893Z,
Searched for captain america  lift,2018-12-19T15:34:09.436Z,
Searched for captain america,2018-12-19T15:33:56.320Z,
Searched for batman best scenes,2018-12-19T07:21:44.342Z,
Searched for #FullEpisode01,2018-12-18T05:19:57.083Z,
Searched for warina hussain,2018-12-15T06:29:18.097Z,
Searched for elseworlds,2018-12-10T14:52:26.271Z,
Searched for elsewords,2018-12-10T14:45:33.777Z,
Searched for elseworls,2018-12-10T14:45:26.073Z,
Searched for knock knock ending,2018-12-09T10:24:34.624Z,
Searched for knock knock best,2018-12-09T10:13:53.517Z,
Searched for knock knock,2018-12-09T09:53:08.649Z,
Searched for monkey,2018-12-08T17:20:02.461Z,
Searched for max pubgm kills,2018-12-08T07:32:23.711Z,
Searched for max pubg kills,2018-12-08T07:29:32.542Z,
Searched for 200iq,2018-12-07T17:30:00.118Z,
Searched for crime,2018-12-06T10:24:39.759Z,
Searched for https://youtu.be/A_Ls1GxlSiA,2018-12-06T10:06:37.168Z,
Searched for f type,2018-12-06T08:01:11.670Z,
Searched for haymur 50 shades of grey,2018-12-05T13:42:40.780Z,
Searched for murhay 50 shades of grey,2018-12-05T13:42:26.486Z,
Searched for garden of words,2018-12-05T12:06:33.668Z,
Searched for before we go ending,2018-12-05T10:27:26.368Z,
Searched for Hindi tennis song,2018-12-05T02:47:37.486Z,
Searched for tennis song,2018-12-05T02:46:39.350Z,
Searched for can you suck,2018-12-05T02:46:30.936Z,
Searched for jai jai shiv shankar,2018-12-05T02:45:57.435Z,
Searched for 18 plus,2018-12-03T18:39:30.683Z,
Searched for crime patrol best scenes,2018-12-03T18:39:05.556Z,
Searched for crime patrol 18 plus scenes,2018-12-03T18:38:55.028Z,
Searched for crime patrol 18 plus,2018-12-03T18:38:45.875Z,
Searched for how to marinate chicken,2018-12-02T13:19:11.574Z,
Searched for oneplus 5,2018-12-01T10:29:07.176Z,
Searched for kamariya,2018-11-30T18:11:55.863Z,
Searched for lo lol,2018-11-28T12:34:29.218Z,
Searched for garden of words,2018-11-28T11:39:49.713Z,
Searched for duke,2018-11-28T09:57:54.974Z,
Searched for urvashi,2018-11-27T03:43:49.358Z,
Searched for ,2018-11-27T02:59:06.782Z,
Searched for maslan design,2018-11-27T02:58:07.484Z,
Searched for maslan,2018-11-27T02:57:48.099Z,
Searched for venom music,2018-11-26T15:53:16.543Z,
Searched for black friday full movie in hindi,2018-11-26T15:49:09.565Z,
Searched for venom music trap,2018-11-26T07:46:44.672Z,
Searched for venom music,2018-11-26T07:45:51.883Z,
Searched for venom,2018-11-26T07:44:50.993Z,
Searched for venom ending scene,2018-11-25T08:26:02.804Z,
Searched for avengers vs ultron animated,2018-11-24T09:44:15.261Z,
Searched for avengers vs ultron,2018-11-24T09:44:04.419Z,
Searched for hulkbuster bruce banner,2018-11-24T06:17:21.638Z,
Searched for hulk buster,2018-11-24T06:03:42.839Z,
Searched for livewire,2018-11-24T04:04:08.309Z,
Searched for zero,2018-11-23T18:18:47.309Z,
Searched for maine,2018-11-23T18:18:36.248Z,
Searched for top woosh,2018-11-23T12:09:24.995Z,
Searched for minions boat,2018-11-23T12:04:56.082Z,
Searched for minions backo,2018-11-23T12:04:17.291Z,
Searched for bako,2018-11-23T12:03:59.491Z,
Searched for weird science ending,2018-11-22T10:07:40.341Z,
Searched for weird science,2018-11-22T10:05:25.178Z,
Searched for #scifimovie,2018-11-22T07:58:44.519Z,
Searched for the fifth element full movie,2018-11-22T07:36:03.948Z,
Searched for iron man nanotechnology armor,2018-11-22T03:47:05.190Z,
Searched for bantai,2018-11-20T11:28:42.515Z,
Searched for bantai,2018-11-20T10:41:36.683Z,
Searched for oxygen os on redmi note 4,2018-11-20T10:02:24.570Z,
Searched for redmi Note 6 Pro,2018-11-20T05:43:36.864Z,
Searched for cars ending,2018-11-19T13:49:05.601Z,
Searched for ratatouille full movie in hindi,2018-11-18T06:22:15.450Z,
Searched for afraid of batman,2018-11-17T13:48:22.921Z,
Searched for batman,2018-11-17T13:48:10.463Z,
Searched for koe no katachi,2018-11-17T13:23:18.337Z,
Searched for l ll be good,2018-11-17T13:13:28.238Z,
Searched for https://youtu.be/2HMVMivv4A8,2018-11-16T18:18:02.113Z,
Searched for sandeepa dhar,2018-11-16T13:55:18.943Z,
Searched for sandeepa dhar,2018-11-16T11:39:52.801Z,
Searched for riddick vs,2018-11-16T07:59:41.751Z,
Searched for sandeepa dhar,2018-11-16T05:33:18.856Z,
Searched for ibne safi imran series,2018-11-15T17:17:47.349Z,
Searched for ibne safi,2018-11-15T17:17:33.220Z,
Searched for melvin louis,2018-11-15T16:17:58.864Z,
Searched for mitron,2018-11-15T16:17:38.662Z,
Searched for penguins of madagascar,2018-11-14T12:58:34.133Z,
Searched for chainsmokers,2018-11-14T12:26:23.965Z,
Searched for statesman vs kingsman,2018-11-14T12:21:47.371Z,
Searched for inanna sarkis best,2018-11-14T12:21:11.404Z,
Searched for inanna sarkis,2018-11-14T12:20:59.429Z,
Searched for Pyaar Lafzon mein kahan song,2018-11-14T12:12:18.713Z,
Searched for Pyaar Lafzon mein kahan,2018-11-14T12:12:07.499Z,
Searched for mann mayal,2018-11-14T12:11:48.042Z,
Searched for sanam maya ali crying,2018-11-14T12:11:10.764Z,
Searched for maya ali dramas,2018-11-14T12:10:55.371Z,
Searched for Maya Ali,2018-11-14T12:10:27.096Z,
Searched for mihaly,2018-11-14T12:10:18.825Z,
Searched for aima baig nanhay haathon,2018-11-14T12:09:03.368Z,
Searched for aima Baig,2018-11-14T12:08:18.884Z,
Searched for I am back,2018-11-14T12:08:04.543Z,
Searched for interstellar,2018-11-14T12:06:47.411Z,
Searched for hande,2018-11-14T12:03:33.684Z,
Searched for away from home,2018-11-14T11:52:36.667Z,
Searched for interstellar override,2018-11-14T11:44:25.448Z,
Searched for override,2018-11-14T11:43:31.655Z,
Searched for fury shows in winter soldier,2018-11-14T11:41:39.500Z,
Searched for how to control anxiety,2018-11-14T06:02:43.181Z,
Searched for i ll be good,2018-11-14T03:14:57.669Z,
Searched for supersonic,2018-11-13T15:02:59.874Z,
Searched for best budget sport shoes pune,2018-11-12T10:59:52.794Z,
Searched for sairat full movie,2018-11-11T08:34:00.433Z,
Searched for sairat 1,2018-11-11T08:33:41.542Z,
Searched for kio no katachi,2018-11-11T08:03:13.430Z,
Searched for me myself,2018-11-11T07:21:12.660Z,
Searched for ted,2018-11-10T17:28:20.776Z,
Searched for 8d music believer,2018-11-10T03:17:19.045Z,
Searched for 8 d,2018-11-10T03:15:18.931Z,
Searched for paralyzed,2018-11-09T18:36:43.244Z,
Searched for bruce almighty movie clip 8,2018-11-09T17:16:52.669Z,
Searched for bruce almighty full movie in hindi dubbed,2018-11-09T17:16:23.822Z,
Searched for #CanvasLaughClub,2018-11-09T16:28:52.963Z,
Searched for stand up comedy,2018-11-09T16:28:40.455Z,
Searched for amv,2018-11-09T14:54:27.577Z,
Searched for best amv,2018-11-09T14:41:03.151Z,
Searched for vevo,2018-11-09T14:40:20.657Z,
Searched for vevoo,2018-11-09T14:40:18.483Z,
Searched for boat 100 vs 225,2018-11-09T05:44:32.855Z,
Searched for boat 100 vs 225,2018-11-08T17:45:48.193Z,
Searched for bass,2018-11-08T17:43:57.462Z,
Searched for 8d music,2018-11-08T17:39:57.833Z,
Searched for cook up a storm full movie,2018-11-08T13:22:19.109Z,
Searched for trailer,2018-11-08T10:46:35.996Z,
Searched for maouli trailer,2018-11-08T10:45:22.650Z,
Searched for maouli,2018-11-08T10:45:07.961Z,
Searched for amv,2018-11-08T08:19:16.494Z,
Searched for daddy mummy,2018-11-08T06:03:20.157Z,
Searched for everything wrong with interstellar,2018-11-07T15:28:49.998Z,
Searched for urvashi old,2018-11-07T14:32:38.250Z,
Searched for urvashi,2018-11-07T14:32:16.453Z,
Searched for machine songs,2018-11-07T13:51:40.597Z,
Searched for machine,2018-11-07T13:51:10.683Z,
Searched for urvashi,2018-11-07T13:38:45.613Z,
Searched for mib 3 time travel,2018-11-07T09:44:18.100Z,
Searched for sheikh chilli,2018-11-07T08:58:06.218Z,
Searched for hayat,2018-11-07T08:52:10.295Z,
Searched for google camera for oneplus 5,2018-11-07T05:28:11.282Z,
Searched for mib j meets k after time travel,2018-11-06T12:37:49.243Z,
Searched for men in black 3 song,2018-11-06T12:31:25.152Z,
Searched for men in black 3 full movie,2018-11-06T11:24:23.354Z,
Searched for mib 3 full,2018-11-06T10:35:58.287Z,
Searched for tu hi hai mera junoon,2018-11-05T19:21:05.943Z,
Searched for urvashi,2018-11-05T18:22:25.665Z,
Searched for my deamons,2018-11-05T17:42:17.228Z,
Searched for naruto amv,2018-11-05T17:39:59.291Z,
Searched for skyfall ending,2018-11-05T17:10:16.261Z,
Searched for jack reacher,2018-11-05T16:37:51.968Z,
Searched for kenny sebastian,2018-11-05T07:54:25.829Z,
Searched for silent voice ending explained,2018-11-04T17:57:37.437Z,
Searched for after eren first transformation,2018-11-02T14:43:46.625Z,
Searched for mikasa removes eren,2018-11-02T14:43:30.031Z,
Searched for silent voice ending,2018-11-02T14:36:19.166Z,
Searched for silent voice ending explained,2018-11-02T14:36:15.392Z,
Searched for two heroes full movie,2018-11-02T13:52:11.585Z,
Searched for zero,2018-11-02T13:08:02.416Z,
Searched for silent voice ending explained,2018-11-02T05:19:22.030Z,
Searched for zero,2018-11-02T05:17:28.310Z,
Searched for 0,2018-11-02T05:17:17.963Z,
Searched for #LoveratriTrailer,2018-11-01T15:45:32.597Z,
Searched for warina h,2018-11-01T15:44:19.317Z,
Searched for akh lad jave,2018-11-01T15:26:17.275Z,
Searched for OnePlus 5 rom,2018-11-01T08:31:00.958Z,
Searched for OnePlus 5,2018-11-01T08:30:57.378Z,
Searched for i ll be good,2018-10-31T07:17:22.391Z,
Searched for naruto vs sasuke,2018-10-31T07:05:43.967Z,
Searched for a silent voice english sub,2018-10-31T06:34:09.053Z,
Searched for a silent voice,2018-10-31T06:33:35.224Z,
Searched for amv,2018-10-31T06:31:10.643Z,
Searched for midoriya todoroki iida vs stain,2018-10-31T04:51:49.781Z,
Searched for midoriya todoroki,2018-10-31T04:51:35.671Z,
Searched for koe no katachi explain,2018-10-31T04:22:19.478Z,
Searched for koe no katachi,2018-10-31T04:21:40.426Z,
Searched for my hero academia amv,2018-10-31T03:59:28.434Z,
Searched for https://youtu.be/jvg4utKSjN8,2018-10-30T10:07:11.712Z,
Searched for oneplus 6t,2018-10-29T16:43:21.186Z,
Searched for oneplus 6t,2018-10-29T14:59:56.244Z,
Searched for OnePlus 6t,2018-10-29T14:49:10.043Z,
Searched for koe no katachi ending,2018-10-29T06:06:54.069Z,
Searched for koe no katachi,2018-10-29T06:06:40.138Z,
Searched for you say run  eren,2018-10-28T16:18:09.455Z,
Searched for erens first transformation full,2018-10-27T18:53:37.873Z,
Searched for eren first full,2018-10-27T18:18:05.133Z,
Searched for eren first full,2018-10-27T16:13:23.278Z,
Searched for eren first full,2018-10-27T15:22:12.979Z,
Searched for eren full,2018-10-27T15:10:52.328Z,
Searched for external youth,2018-10-27T13:49:20.232Z,
Searched for endless love from the myth,2018-10-27T13:48:48.045Z,
Searched for external youth,2018-10-27T11:48:55.985Z,
Searched for external youth,2018-10-27T09:12:11.850Z,
Searched for hip hop,2018-10-27T03:27:16.028Z,
Searched for #tokyodreaming,2018-10-27T03:27:12.115Z,
Searched for hip hop tokiyo,2018-10-27T03:26:21.454Z,
Searched for varun grovar,2018-10-25T19:35:22.900Z,
Searched for eren hip hop,2018-10-25T19:34:23.872Z,
Searched for eren hi hop,2018-10-25T19:33:47.944Z,
Searched for hip hop,2018-10-25T19:33:06.834Z,
