title,time,details
Searched for warrior,2020-09-17T10:48:17.001Z,
Searched for social dilemma,2020-09-17T08:01:42.067Z,
Searched for social dilemma,2020-09-16T18:57:34.526Z,
Visited https://tribesindia.com?https://www.tribesindia.com/,2020-09-16T18:25:20.373Z,[{'name': 'From Google Ads'}]
Searched for ipad air 4,2020-09-16T05:50:16.111Z,
Searched for freecodecamp.org zero to pandas,2020-09-15T20:00:47.594Z,
Answered survey question,2020-09-15T09:51:53.054Z,[{'name': 'From Google Ads'}]
Searched for captian Philips 6/10,2020-09-13T16:44:18.001Z,
Searched for captian Philips 5/10,2020-09-13T16:41:13.075Z,
Searched for captian Philips 3/10,2020-09-13T16:30:51.678Z,
Searched for charas ganja mere ko pyara,2020-09-13T14:38:32.448Z,
Searched for psychedelic,2020-09-13T14:33:09.479Z,
Searched for psylocke,2020-09-13T14:32:45.865Z,
Searched for soap after 20 sec,2020-09-13T14:03:29.685Z,
Answered survey question,2020-09-12T10:44:28.840Z,[{'name': 'From Google Ads'}]
Searched for cold war,2020-09-10T08:20:09.032Z,
Searched for bol kaffara,2020-09-09T11:14:15.932Z,
Searched for kroor darshan,2020-09-09T06:58:13.599Z,
Searched for freecodecamp.org zero to pandas,2020-09-08T13:58:35.725Z,
Searched for freecodecamp.org,2020-09-08T13:58:21.549Z,
Visited https://www.johnjacobseyewear.com/?utm_source=google&utm_campaign=ET-026-Discovery-TOF-CI-Opt-Checkout,2020-09-07T18:25:05.319Z,[{'name': 'From Google Ads'}]
Searched for quint,2020-09-07T06:30:13.894Z,
Searched for India,2020-09-07T00:55:49.440Z,
Searched for postman,2020-09-04T18:22:59.023Z,
Searched for restfull web services,2020-09-04T18:04:41.184Z,
Searched for rest full web services,2020-09-04T17:55:45.253Z,
Searched for faug,2020-09-04T13:18:24.512Z,
Searched for bhuvan bam,2020-09-04T06:54:28.715Z,
Searched for mkbhd,2020-09-04T03:15:54.033Z,
Searched for technical guruji,2020-09-04T03:15:35.992Z,
Searched for rashi,2020-09-03T04:19:56.360Z,
Searched for mkbhd,2020-09-02T16:47:08.888Z,
Searched for man ki baat august 2020,2020-09-01T06:07:26.551Z,
Searched for mastaani,2020-08-31T17:47:56.465Z,
Searched for yogi baba,2020-08-31T17:41:04.222Z,
Answered survey question,2020-08-31T11:24:35.948Z,[{'name': 'From Google Ads'}]
Searched for we are awesome 2020,2020-08-31T10:31:01.892Z,
Searched for man ki baat august 2020,2020-08-31T09:13:52.689Z,
Searched for man ki baat,2020-08-31T09:12:39.066Z,
Searched for docking,2020-08-31T08:25:12.201Z,
Searched for yusuf story,2020-08-30T18:06:15.347Z,
Searched for yousuf story,2020-08-30T18:03:25.570Z,
Searched for yousuf,2020-08-30T18:03:12.389Z,
Searched for yakub,2020-08-30T18:03:01.961Z,
Searched for man ki baat August 2020,2020-08-30T16:50:51.750Z,
Searched for man ki baat,2020-08-30T16:50:20.877Z,
Searched for free code camp,2020-08-30T06:22:39.802Z,
Searched for c,2020-08-29T14:45:50.107Z,
Searched for meduza,2020-08-29T05:38:15.384Z,
Visited https://www.decathlon.in/p/8173020/universal-bike-cyclometer-magnet#fo_c=1720&fo_k=725bc426d4945161a55451f67ae1a0e1&fo_s=gplain?utm_source=google&utm_medium=cpc&utm_campaign=Shopping_Cycling_V3_Dec'19_RPC&utm_content=Cycling_%3e_Cycling_Accessories_%3e_Bike_Computers&utm_term=,2020-08-28T18:43:48.368Z,[{'name': 'From Google Ads'}]
Searched for attahiyat lillahi wa salawatu,2020-08-28T18:04:47.716Z,
Searched for c,2020-08-28T15:00:49.572Z,
Visited https://www.flipkart.com/oppo-a53-coming-soon-ii23j72k-store?ocmpid=BrandAd_OPPO_A53_Media_YTV_FK32,2020-08-28T14:57:16.629Z,[{'name': 'From Google Ads'}]
Searched for OnePlus 8t,2020-08-28T14:14:02.334Z,
Searched for OnePlus 8,2020-08-28T14:13:56.256Z,
Searched for detach interstellar,2020-08-27T17:06:48.613Z,
Searched for detach,2020-08-27T17:06:35.348Z,
Searched for him and i,2020-08-25T18:02:59.455Z,
Searched for attahiyat full,2020-08-25T16:04:48.642Z,
Searched for 200 iq,2020-08-25T10:03:21.689Z,
Searched for quran about character assassination hindi,2020-08-25T05:12:19.833Z,
Searched for allah about character assassination hindi,2020-08-25T05:11:58.391Z,
Searched for #YasirQadhi,2020-08-24T18:56:32.704Z,
Visited https://www.flipkart.com/realme-c15/p/itm70ebdb8a0fbdf?pid=MOBFUEPQUYDNJFAG&cmpid=socialorg_realmeC15_BrandFilm_YT,2020-08-24T17:40:09.365Z,[{'name': 'From Google Ads'}]
Searched for pubgm god,2020-08-24T12:59:48.120Z,
Searched for segarazo,2020-08-23T08:30:00.969Z,
Searched for oneplus 6 custom rom,2020-08-23T08:18:25.072Z,
Searched for on and on,2020-08-19T11:16:27.027Z,
Searched for are yaar meri,2020-08-19T11:02:46.870Z,
Searched for temple glitch,2020-08-19T03:49:13.050Z,
Searched for tafsir hindi,2020-08-18T19:14:12.090Z,
Searched for tafsir,2020-08-18T19:12:15.477Z,
Searched for dasha taran,2020-08-16T10:37:09.533Z,
Searched for c in 4 hours,2020-08-15T08:18:13.590Z,
Searched for watch dogs on mobile,2020-08-15T05:13:16.321Z,
Searched for watch dogs,2020-08-15T05:12:58.275Z,
Searched for him and i,2020-08-14T17:53:51.658Z,
Searched for c15,2020-08-14T15:01:21.540Z,
Searched for how to be a good husband,2020-08-14T04:39:51.383Z,
Searched for free quran education,2020-08-14T04:37:35.133Z,
Searched for why are we even,2020-08-13T19:35:14.905Z,
Searched for OnePlus,2020-08-13T14:15:59.390Z,
Searched for play with fire,2020-08-13T09:03:36.679Z,
Searched for sadak 2 trailer,2020-08-12T12:55:05.811Z,
Searched for varun grover,2020-08-12T08:40:36.237Z,
Searched for shroud skin,2020-08-12T06:05:38.035Z,
Searched for how to tweak your kernel,2020-08-10T19:04:09.347Z,
Searched for how to manage your kernel,2020-08-10T19:03:43.849Z,
Searched for how to manage your kernal,2020-08-10T19:03:38.050Z,
Searched for ali,2020-08-10T14:18:13.119Z,
Searched for rom,2020-08-09T20:29:47.634Z,
Searched for sanhok.exe,2020-08-09T20:24:12.731Z,
Searched for realme 6i,2020-08-09T13:40:21.224Z,
Searched for oxygen os 11,2020-08-09T13:34:14.908Z,
Searched for Samsung fridge,2020-08-08T05:26:43.043Z,
Searched for how to backuo full rom,2020-08-07T18:29:59.604Z,
Searched for realme 6i vs,2020-08-06T13:47:53.218Z,
Searched for narzo 10a performance,2020-08-06T13:20:28.687Z,
Visited market://details?id=com.snapchat.android,2020-08-06T13:19:48.755Z,[{'name': 'From Google Ads'}]
Searched for narzo 10 performance,2020-08-06T13:19:36.716Z,
Searched for 3d sound,2020-08-05T19:57:01.901Z,
Searched for OnePlus 6 custom,2020-08-05T19:25:21.518Z,
Searched for OnePlus 6,2020-08-05T19:25:13.322Z,
Searched for best tv in india 2020,2020-08-05T17:10:25.160Z,
Searched for realme 6i,2020-08-05T10:04:53.382Z,
Searched for aod for oneplus,2020-08-05T09:49:27.117Z,
Searched for mkbhd,2020-08-05T05:44:56.928Z,
Searched for dasha taran,2020-08-04T19:27:45.022Z,
Searched for pubg squad 999,2020-08-04T17:53:42.241Z,
Searched for pubg tactics and tips,2020-08-04T12:11:34.428Z,
Searched for corvus,2020-08-03T19:52:38.136Z,
Searched for always on display,2020-08-03T19:43:54.076Z,
Visited market://details?id=com.amazon.mp3,2020-08-03T19:24:43.387Z,[{'name': 'From Google Ads'}]
Searched for sound quality,2020-08-03T11:40:36.159Z,
Searched for pubg 999,2020-08-03T11:16:39.606Z,
Searched for custom rom oneplus 6,2020-08-03T07:24:12.911Z,
Searched for oem unlock OnePlus 6,2020-08-03T07:02:30.493Z,
Searched for oem unlock,2020-08-03T07:01:31.282Z,
Searched for standup,2020-08-02T18:00:01.115Z,
Searched for pubg screen smoother,2020-08-02T14:27:51.630Z,
Searched for OnePlus 6 custom techi bee,2020-08-02T13:35:40.664Z,
Searched for OnePlus 6 custom techi,2020-08-02T13:35:29.263Z,
Searched for OnePlus 6 custom,2020-08-02T13:35:06.099Z,
Searched for OnePlus 6,2020-08-02T13:34:55.254Z,
Searched for corvus vs oxygenos,2020-08-02T11:38:12.977Z,
Searched for oneplus 7t vs oneplus nord,2020-08-02T11:20:34.183Z,
Searched for oneplus 6 twrp install,2020-08-02T08:58:34.289Z,
Searched for corvus in OnePlus 6,2020-08-02T08:11:00.195Z,
Searched for pubg oxygen os,2020-08-01T19:57:22.281Z,
Searched for why don't you say so,2020-08-01T16:09:36.315Z,
Searched for Germany pune,2020-08-01T11:14:32.460Z,
Searched for shridhar,2020-08-01T11:14:23.117Z,
Searched for OnePlus 6 rom,2020-07-31T19:14:16.921Z,
Searched for oxygen os vs custom rom,2020-07-31T19:00:59.443Z,
Searched for mkbhd,2020-07-31T11:27:11.382Z,
Searched for OnePlus 6 pubg,2020-07-31T05:55:44.705Z,
Searched for how to rooot OnePlus 6,2020-07-30T09:22:08.818Z,
Searched for yam yam song,2020-07-29T20:11:25.994Z,
Searched for bull attack in village pakistan shoot with gun,2020-07-28T19:48:10.030Z,
Searched for bull attack in village pakistan,2020-07-28T19:47:58.167Z,
Searched for bull attack in village india,2020-07-28T19:47:28.211Z,
Searched for bull attack,2020-07-28T19:47:19.675Z,
Searched for mad cow,2020-07-28T19:46:10.957Z,
Searched for airsoft toy gun,2020-07-28T19:42:43.509Z,
Searched for co2 gun firing,2020-07-28T19:42:00.726Z,
Searched for jerryrigeverything,2020-07-28T05:10:44.902Z,
Searched for mortal best pubg moments,2020-07-27T19:52:21.086Z,
Searched for pubg Iq,2020-07-27T19:47:43.285Z,
Searched for standup,2020-07-27T19:17:42.118Z,
Searched for Playing with fire,2020-07-27T14:48:11.944Z,
Visited http://clickserve.dartsearch.net/link/click?&&ds_e_adid=435319671961&ds_e_matchtype=&ds_e_device=m&ds_e_network=&&ds_url_v=2&ds_dest_url=https://www.airtel.in/broadband/?utm_Source=pfx_google_display_discover_broadband_custom_audience&utm_content=broadband_custom_audience&utm_medium=discover&utm_campaign=discovery_Open_Feb'20&cid=dsp&gclsrc=aw.ds&,2020-07-27T10:00:23.534Z,[{'name': 'From Google Ads'}]
Searched for introduction to design engineer,2020-07-25T05:58:30.470Z,
Searched for introduction to design,2020-07-25T05:58:18.945Z,
Searched for jerryrigeverything,2020-07-25T05:44:01.799Z,
Searched for jerryrigeverything oneplus nord,2020-07-25T05:43:52.781Z,
Searched for jerryrigeverything m20,2020-07-25T05:43:24.424Z,
Searched for pibg gyro,2020-07-24T13:20:04.175Z,
Searched for ssc clg,2020-07-22T08:15:46.100Z,
Searched for oneplus earbuds,2020-07-22T06:38:43.772Z,
Searched for dave lee,2020-07-22T06:36:41.073Z,
Searched for say so,2020-07-22T05:35:04.207Z,
Searched for OnePlus,2020-07-21T14:25:42.599Z,
Searched for kitty kitty do you love me,2020-07-21T09:37:36.826Z,
Searched for production engineer,2020-07-21T08:59:18.445Z,
Searched for tell me about yourself interview,2020-07-21T08:47:07.170Z,
Searched for 765g,2020-07-20T07:14:15.644Z,
Searched for 765,2020-07-20T07:14:10.914Z,
Searched for unbox therapy,2020-07-19T14:45:16.361Z,
Searched for mini 14 vs m416 pubg,2020-07-17T08:07:52.439Z,
Searched for mini 14 pubgm,2020-07-17T08:04:36.036Z,
Searched for mini 14 pubg,2020-07-17T08:04:33.411Z,
Searched for mini 14 auto pubg,2020-07-17T08:01:22.406Z,
Searched for death bed,2020-07-17T07:07:25.478Z,
Searched for how to gyroscope pubg mobile,2020-07-16T10:28:29.935Z,
Searched for death bed,2020-07-16T07:04:48.404Z,
Searched for vaibhavyt,2020-07-15T19:38:07.578Z,
Searched for vaibhav,2020-07-15T19:38:02.518Z,
Searched for pubg sensitivity settings,2020-07-15T19:37:17.314Z,
Searched for best budget phone,2020-07-15T04:24:49.123Z,
Searched for sensitivity,2020-07-14T07:48:29.603Z,
Searched for kunal kamra,2020-07-12T10:00:57.094Z,
Searched for fnatic in OnePlus 6,2020-07-12T07:52:34.115Z,
Searched for kunal kamra,2020-07-11T16:18:49.059Z,
Searched for gary sims,2020-07-11T11:43:26.770Z,
Searched for i love your voice,2020-07-11T06:47:34.324Z,
Searched for panda,2020-07-11T04:49:47.857Z,
Searched for ninja,2020-07-10T07:36:56.074Z,
Searched for marques brownlee,2020-07-07T15:20:57.521Z,
Searched for pubg bootcamp,2020-07-07T07:12:25.353Z,
Searched for pubg team,2020-07-07T07:12:03.314Z,
Searched for pubg,2020-07-07T07:11:47.556Z,
Visited market://details?id=com.discoveryplus.mobile.android,2020-07-07T07:01:48.053Z,[{'name': 'From Google Ads'}]
Searched for budget laptop 2020,2020-07-06T12:13:30.114Z,
Searched for all the boys i've loved before kiss,2020-07-05T07:37:00.001Z,
Searched for all the boys i've loved before kids,2020-07-05T07:36:55.198Z,
Searched for all the boys i've loved before,2020-07-05T07:35:47.896Z,
Searched for gd bakshi,2020-07-05T05:59:06.999Z,
Searched for my baby love,2020-07-04T19:29:03.424Z,
Searched for OnePlus,2020-07-02T15:10:36.940Z,
Searched for pete lau,2020-07-02T14:01:28.324Z,
Searched for oneplus,2020-06-30T14:05:00.673Z,
Searched for OnePlus,2020-06-30T07:54:21.471Z,
Searched for #EnglishSongLyrics,2020-06-29T14:09:42.973Z,
Searched for my baby love,2020-06-29T14:09:08.772Z,
Searched for bam bam bam bam,2020-06-28T14:17:19.269Z,
Searched for realme x3,2020-06-28T13:33:01.884Z,
Searched for x3,2020-06-28T08:51:24.405Z,
Searched for x4,2020-06-28T08:51:20.896Z,
Searched for ted riddle,2020-06-27T10:18:41.642Z,
Searched for technical guruji,2020-06-27T08:23:24.413Z,
Searched for mkbhd,2020-06-27T08:22:09.580Z,
Searched for playdate,2020-06-26T13:22:51.021Z,
Searched for ipad mini 5,2020-06-25T08:53:05.078Z,
Searched for ipad mini 5,2020-06-25T06:40:44.916Z,
Searched for budget monitor 18 inch,2020-06-23T18:05:46.904Z,
Searched for budget monitor,2020-06-23T17:56:20.594Z,
Searched for playdate,2020-06-22T17:06:47.938Z,
Searched for playdate,2020-06-22T15:15:39.913Z,
Searched for scout erangel 2.0,2020-06-22T11:06:37.391Z,
Searched for growing up with pravya and drisha,2020-06-21T16:49:02.016Z,
Searched for growing up with prvya,2020-06-21T16:48:49.812Z,
Searched for bharat 5,2020-06-21T16:43:43.823Z,
Searched for motivation by dhinchak pooja,2020-06-21T15:48:49.533Z,
Searched for motivation,2020-06-21T15:45:20.254Z,
Searched for Eclipse live,2020-06-21T05:38:12.156Z,
Visited market://details?id=com.moonvideo.android.resso,2020-06-20T12:57:11.662Z,[{'name': 'From Google Ads'}]
Searched for playdate,2020-06-18T13:09:04.566Z,
Searched for amd 4000 ryzen,2020-06-17T09:19:38.039Z,
Searched for amd vs intel,2020-06-17T09:19:03.885Z,
Searched for infinity war snap scene,2020-06-16T16:29:51.240Z,
Searched for moto z2 play disassembly,2020-06-16T14:56:45.968Z,
Searched for realme 10a,2020-06-11T05:26:28.025Z,
Searched for realme 6,2020-06-11T05:23:28.747Z,
Searched for premiere pro free alternative,2020-06-10T15:08:21.183Z,
Searched for premiere pro alternative,2020-06-10T15:07:21.613Z,
Searched for Subscribe animation,2020-06-06T15:20:54.411Z,
Searched for hand below animation,2020-06-06T15:16:26.389Z,
Searched for 2d blast animations,2020-06-06T14:27:30.881Z,
Searched for 2d small animations,2020-06-06T14:27:00.299Z,
Searched for emoji animation,2020-06-06T11:45:52.341Z,
Searched for bored black screen animation,2020-06-06T09:10:42.441Z,
Searched for welcome with black screen animation,2020-06-06T08:13:25.381Z,
Searched for welcome with black screen,2020-06-06T08:13:15.503Z,
Searched for hi animation with blackscreen,2020-06-05T17:19:49.119Z,
Searched for free green screen transition effect narasiid,2020-06-05T06:19:56.793Z,
Searched for free green screen transition effect,2020-06-05T06:18:54.443Z,
Searched for free green screentransition  effect,2020-06-05T06:18:38.789Z,
Searched for growing up with prvya,2020-06-05T06:13:47.682Z,
Searched for free green screen transition effects,2020-06-05T06:12:07.374Z,
Searched for free green screen trans,2020-06-05T06:11:57.399Z,
Searched for how to make a youtube video thumbnail,2020-05-15T09:14:49.650Z,
Searched for How to roll back to stable oneplus 6,2020-05-12T17:44:12.319Z,
Searched for How to roll back to stable oneplus 6,2020-05-11T08:57:42.043Z,
Searched for oneplus 7t,2020-05-09T09:44:56.492Z,
Searched for skill-lync,2020-04-23T05:10:03.090Z,
Searched for ssimpotashka decrypt,2020-04-17T14:43:55.012Z,
Searched for ssimpotashka,2020-04-17T14:43:43.530Z,
Searched for how to make intro nad outro,2020-04-16T07:40:07.720Z,
Searched for note 10 lite,2020-01-04T20:00:53.275Z,
Searched for mqbhd,2020-01-04T19:54:26.827Z,
Searched for s10 lite,2020-01-04T17:46:24.345Z,
Searched for mqbhd,2020-01-04T17:46:02.689Z,
Searched for smart watch budget,2020-01-04T17:35:09.082Z,
Searched for oneplus 6 vs oneplus 5t,2020-01-04T17:33:04.228Z,
Searched for oneplus 6 in 2019,2020-01-04T17:31:55.934Z,
Searched for oneplus 6 in 2019,2020-01-04T15:10:11.328Z,
Searched for igbt,2020-01-02T11:57:38.076Z,
Searched for current mirror igbt,2020-01-02T11:57:16.815Z,
Searched for current mirror circuit,2020-01-02T11:57:06.661Z,
Searched for igbt motor controller,2020-01-02T11:56:08.597Z,
Searched for igbt driver circuit,2020-01-02T11:48:54.694Z,
Searched for upload and fetch image firebase,2020-01-02T11:09:55.622Z,
Searched for cathlin car,2020-01-02T08:22:49.182Z,
Searched for white screen,2020-01-01T15:12:30.393Z,
Searched for screen burn in oneplus 6,2020-01-01T15:11:02.597Z,
Searched for oneplus 6 in 2019,2020-01-01T15:01:08.169Z,
Searched for two degree of freedom system vibration,2020-01-01T06:35:52.072Z,
Searched for OnePlus 6 mqbhd,2020-01-01T03:29:34.998Z,
Searched for OnePlus 6,2020-01-01T03:29:07.634Z,
Searched for oneplus 6 vs oneplus 5t,2019-12-31T18:31:11.784Z,
Searched for 2160p,2019-12-31T14:11:19.757Z,
Searched for 1080p,2019-12-31T14:08:34.380Z,
Searched for leg day fails,2019-12-31T10:14:32.122Z,
Searched for 1080p,2019-12-30T18:28:55.572Z,
Searched for smartphone under 5000,2019-11-04T16:01:01.097Z,
Searched for realme c2,2019-11-04T14:55:24.304Z,
Searched for best smartphone under 6000,2019-11-04T14:52:35.075Z,
Searched for best smartphone under 10000,2019-11-04T14:47:21.548Z,
Searched for interfacing esp8266 with atmega16,2019-11-04T14:10:44.132Z,
Searched for interfacing esp8266 with atmega64,2019-11-04T13:31:41.872Z,
Searched for usart in atmega64,2019-11-04T13:20:11.312Z,
Searched for USART,2019-11-04T13:18:41.317Z,
Searched for atmel programming basics,2019-11-03T11:18:56.898Z,
Searched for atmega programmingbasic,2019-11-03T11:18:52.023Z,
Searched for atmega usart basic,2019-11-03T11:16:24.922Z,
Searched for atmega 64,2019-11-03T11:14:52.401Z,
Searched for how to simulate wifi module in proteus,2019-11-01T12:07:47.500Z,
Searched for led blinking with atmega 16 on proteus,2019-11-01T11:46:12.555Z,
Searched for inerfacing of wifi module esp8266 with atmega16,2019-11-01T11:20:27.189Z,
Searched for inerfacing of wifi module esp8266 with pic on proteus,2019-11-01T11:19:18.370Z,
Searched for atmel studio 7 tutorial,2019-10-24T08:36:02.935Z,
Searched for mastercam lathe tutorial,2019-10-23T09:25:22.486Z,
Searched for mastercam milling tutorial,2019-10-23T09:02:23.679Z,
Searched for print a number triangle in c,2019-10-22T18:37:45.620Z,
Searched for print a star triangle in c,2019-10-22T18:04:32.386Z,
Searched for road to jungle music,2019-10-06T17:52:31.354Z,
Searched for roar,2019-10-06T10:28:47.277Z,
Searched for hershey cocoa powder recipes,2019-10-06T09:07:49.052Z,
Searched for cocoa powder recipes,2019-10-06T08:59:59.303Z,
Searched for daily dose of cocoa powder,2019-10-06T08:29:42.302Z,
Searched for is cocoa powder healthy,2019-10-06T04:37:58.865Z,
Searched for 1080p,2019-10-06T03:56:43.897Z,
Searched for benefits of cocoa powder with milk,2019-10-06T03:26:45.190Z,
Searched for mqbhd,2019-10-05T18:09:11.901Z,
Searched for yogendra yadav savage,2019-10-05T04:36:09.520Z,
Searched for yogendra yadav sawage,2019-10-05T04:36:05.819Z,
Searched for yogendra yadav,2019-10-05T04:34:46.827Z,
Searched for surface headphones,2019-10-05T04:11:38.132Z,
Searched for amit shah speech today,2019-10-04T16:57:05.915Z,
Searched for kanhaiya kumar 2 oct,2019-10-04T10:35:19.500Z,
Searched for kanhaiya kumar,2019-10-04T10:35:05.150Z,
Searched for istekhara shaitan,2019-10-02T16:39:07.346Z,
Searched for istekhara could be,2019-10-02T16:38:58.291Z,
Searched for istikhara,2019-10-02T16:38:37.763Z,
Searched for istekhara,2019-10-02T16:38:17.026Z,
Searched for OnePlus 7t,2019-10-02T10:31:02.528Z,
Searched for oneplus 7t vs oppo,2019-10-02T10:28:19.959Z,
Searched for video,2019-09-30T16:52:56.618Z,
Searched for dolby,2019-09-30T09:55:55.640Z,
Searched for dolby sound channel architecture,2019-09-30T09:53:29.593Z,
Searched for dolby sound channel,2019-09-30T09:53:19.959Z,
Searched for 3d sound,2019-09-30T09:47:39.366Z,
Searched for kashmir the print,2019-09-30T09:21:01.693Z,
Searched for kashmir,2019-09-30T09:20:51.420Z,
Searched for the print,2019-09-30T09:19:22.098Z,
Searched for bb ki vines voice,2019-09-29T18:32:54.440Z,
Searched for bb ki vines,2019-09-29T18:29:50.272Z,
Searched for bbkivines,2019-09-29T18:29:19.817Z,
Searched for kunal kamra,2019-09-29T18:18:38.476Z,
Searched for standup,2019-09-29T17:53:59.697Z,
Searched for stabilizer,2019-09-29T17:40:19.923Z,
Searched for 3d sound,2019-09-29T17:24:15.892Z,
Searched for 3d soun,2019-09-29T17:20:12.068Z,
Searched for 3d movies,2019-09-29T17:19:53.746Z,
Searched for yaseen by mishary,2019-09-29T12:14:45.838Z,
Searched for yaseen,2019-09-29T12:13:09.697Z,
Searched for arey yaar meri tum bhi ho gazab,2019-09-29T11:53:00.825Z,
Searched for realme vs boat 225f,2019-09-29T03:19:29.310Z,
Searched for realme vs boat 225,2019-09-29T03:06:25.287Z,
Searched for boat 225,2019-09-28T15:06:42.826Z,
Searched for tell them,2019-09-28T15:06:34.128Z,
Searched for tell them,2019-09-28T13:52:27.262Z,
Searched for it ain't me,2019-09-28T13:34:28.800Z,
Searched for varun grover,2019-09-28T12:29:33.242Z,
Searched for varun grover,2019-09-28T09:10:13.208Z,
Searched for azadi,2019-09-28T08:52:51.301Z,
Searched for pune news,2019-09-26T07:14:56.337Z,
Searched for gon vs pitou,2019-09-25T16:15:54.200Z,
Searched for dhanshree barbole,2019-09-25T08:07:09.098Z,
Searched for ppg films 2018,2019-09-25T07:43:57.115Z,
Searched for ppg flims 2018,2019-09-25T07:43:39.593Z,
Searched for ppg flims,2019-09-25T05:32:49.200Z,
Searched for naruto sad,2019-09-24T17:56:19.206Z,
Searched for naruto,2019-09-24T17:55:55.127Z,
Searched for raffaello d'andrea,2019-09-24T14:58:54.992Z,
Searched for gle,2019-09-24T12:58:49.447Z,
Searched for ravish kumar,2019-09-24T12:01:06.714Z,
Searched for saas bhi kabhi bahu thi remix,2019-09-24T11:40:54.382Z,
Searched for bbc earth,2019-09-22T15:36:37.986Z,
Searched for kare to kare kya bole to bole kya,2019-09-22T10:34:32.343Z,
Searched for honey badger,2019-09-22T09:32:03.451Z,
Searched for indian election patriot act,2019-09-21T16:25:11.079Z,
Searched for india election,2019-09-21T16:24:58.239Z,
Searched for the patriot act theme song,2019-09-21T07:37:38.918Z,
Searched for left right earphone test,2019-09-20T11:33:21.834Z,
Searched for tdk earphones,2019-09-20T10:24:27.476Z,
Searched for 3d printing polyjet,2019-09-20T06:30:07.374Z,
Searched for 3d printing process,2019-09-20T06:26:58.061Z,
Searched for abp news,2019-09-19T08:55:36.090Z,
Searched for hasan minhaj,2019-09-18T19:14:15.386Z,
Searched for patriot act music,2019-09-18T19:09:48.321Z,
Searched for patriot act hasan minhaj,2019-09-18T18:20:02.890Z,
Searched for patriotic songs,2019-09-18T18:19:56.224Z,
Searched for magisk,2019-09-18T17:41:14.785Z,
Searched for revolt rv400,2019-09-18T16:29:21.452Z,
Searched for naruto sad,2019-09-18T15:51:16.708Z,
Searched for #standupcomedy,2019-09-18T07:08:34.603Z,
Searched for stand up comedy indian,2019-09-18T06:59:43.464Z,
Searched for #standup,2019-09-18T06:59:37.285Z,
Searched for standup,2019-09-18T06:57:58.618Z,
Searched for captain America shield test,2019-09-17T17:41:59.275Z,
Searched for pubg boy mad,2019-09-17T15:25:45.610Z,
Searched for pubg,2019-09-17T15:25:32.570Z,
Searched for pubg crazy boy,2019-09-17T15:24:43.812Z,
Searched for parody,2019-09-17T14:11:31.279Z,
Searched for parody,2019-09-17T12:11:22.315Z,
Searched for pal pal dil,2019-09-16T16:52:16.975Z,
Searched for choodiyan,2019-09-16T16:50:52.767Z,
Searched for joker robin,2019-09-16T08:45:15.509Z,
Searched for joker anime story,2019-09-16T08:38:53.537Z,
Searched for joker anime,2019-09-16T08:38:45.233Z,
Searched for joker,2019-09-16T08:33:43.603Z,
Searched for standup,2019-09-15T05:42:09.526Z,
Searched for 1more piston fit vs,2019-09-14T16:59:58.192Z,
Searched for 1more piston fit vs mi earphones,2019-09-14T16:52:19.541Z,
Searched for naruto sad,2019-09-14T15:26:23.258Z,
Searched for naruto,2019-09-14T15:26:19.929Z,
Searched for earphone test,2019-09-14T14:54:31.786Z,
Searched for earphone test,2019-09-13T19:01:19.952Z,
Searched for blink earphones,2019-09-13T18:30:16.879Z,
Searched for blink play earphones,2019-09-13T18:28:21.860Z,
Searched for sennheiser,2019-09-13T18:15:23.278Z,
Searched for sennheiser cx 180 vs jbl c100si,2019-09-13T18:10:53.591Z,
Searched for sennheiser cx 180,2019-09-13T18:10:46.720Z,
Searched for best budget earphones,2019-09-13T18:05:27.125Z,
Searched for best earphones under 1000 rs,2019-09-13T16:23:23.582Z,
Searched for best earphones,2019-09-13T16:23:17.070Z,
Searched for left right earphone test,2019-09-13T14:48:31.527Z,
Searched for how to colour code earphone,2019-09-13T14:46:01.629Z,
Searched for how to give a child burb,2019-09-13T09:19:20.995Z,
Searched for how to give a child butb,2019-09-13T09:19:12.042Z,
Searched for how to give a child occur,2019-09-13T09:19:07.722Z,
Searched for m.2 vs optane,2019-09-13T02:33:33.909Z,
Searched for optane +ssd,2019-09-13T02:32:05.941Z,
Searched for optane memory,2019-09-13T02:24:01.875Z,
Searched for revisit,2019-09-12T19:08:23.837Z,
Searched for review,2019-09-12T19:07:44.606Z,
Searched for i3 vs i5 vs i7 8th generation,2019-09-12T16:43:21.310Z,
Searched for i3 vs i5 vs i7,2019-09-12T16:42:11.163Z,
Searched for ryzen 3rd gen,2019-09-12T16:05:00.281Z,
Searched for r3 3200g vs i3 8100,2019-09-12T15:55:06.655Z,
Searched for r3 vs i3,2019-09-12T15:54:49.920Z,
Searched for ryzen 3rd gen vs intel 9th gen,2019-09-12T15:48:10.200Z,
Searched for ryzen 3rd gen,2019-09-12T15:23:02.575Z,
Searched for funny commercials,2019-09-12T11:47:48.894Z,
Searched for funny tik tok videos,2019-09-12T11:47:41.755Z,
Searched for xps 13 2015,2019-09-11T16:51:51.815Z,
Searched for iphone 11 pro,2019-09-11T04:36:17.880Z,
Searched for custom laptop,2019-09-10T18:50:55.994Z,
Searched for the verge build a pc,2019-09-10T09:30:48.660Z,
Searched for the verge,2019-09-10T09:30:39.634Z,
Searched for in a nutshell,2019-09-09T18:29:04.954Z,
