title,time,details
Searched for blue bird,2018-10-25T19:30:15.032Z,
Searched for eren rampage,2018-10-25T08:20:18.080Z,
Searched for naruto sad trap,2018-10-23T19:07:02.436Z,
Searched for standup,2018-10-23T18:58:37.443Z,
Searched for hip hop,2018-10-23T18:48:02.188Z,
Searched for my hero academia rising music,2018-10-23T15:12:10.493Z,
Searched for my hero academia rising,2018-10-23T15:11:53.982Z,
Searched for my hero academia rise amv,2018-10-23T15:11:48.124Z,
Searched for my hero academia,2018-10-23T15:11:41.925Z,
Searched for border e pubg,2018-10-23T12:55:54.198Z,
Searched for https://youtu.be/mqPra3kUkMg,2018-10-23T12:44:47.522Z,
Searched for dastane pubg,2018-10-23T12:43:31.738Z,
Searched for beyond,2018-10-21T18:17:40.534Z,
Searched for antisocial comedy jam,2018-10-21T17:40:19.050Z,
Searched for antisocial,2018-10-21T17:39:15.645Z,
Searched for stand up comedy,2018-10-21T14:24:18.145Z,
Searched for Aakash Mehta,2018-10-21T13:19:35.199Z,
Searched for Kashmir,2018-10-21T13:19:24.047Z,
Searched for ted,2018-10-18T18:26:20.325Z,
Searched for simon sinek,2018-10-18T18:02:29.260Z,
Searched for Monroe shock absorber,2018-10-18T06:43:48.211Z,
Searched for ZF vs Monroe which one better,2018-10-18T06:43:25.996Z,
Searched for simon sinek,2018-10-18T04:57:52.794Z,
Searched for simon,2018-10-18T04:29:14.692Z,
Searched for kunal kamra,2018-10-18T04:28:34.589Z,
Searched for oneplus 5,2018-10-17T16:09:48.205Z,
Searched for kunal,2018-10-17T14:01:09.302Z,
Searched for kanal,2018-10-17T14:01:05.393Z,
Searched for you say run,2018-10-17T13:50:14.119Z,
Searched for deku first,2018-10-17T11:53:53.681Z,
Searched for my hero academia,2018-10-17T11:53:41.955Z,
Searched for gcam oneplus 5,2018-10-17T10:15:48.578Z,
Searched for #GCAM,2018-10-17T10:09:57.711Z,
Searched for mikasa,2018-10-16T19:35:24.435Z,
Searched for comedy,2018-10-16T19:27:20.446Z,
Searched for biswa,2018-10-16T19:23:18.245Z,
Searched for biswa,2018-10-16T18:40:07.345Z,
Searched for comedy,2018-10-16T18:33:07.218Z,
Searched for standup,2018-10-16T17:27:16.987Z,
Searched for eren 1 transformation,2018-10-16T15:08:24.534Z,
Searched for mikasa,2018-10-16T15:01:50.592Z,
Searched for stand up comedy,2018-10-14T20:22:29.899Z,
Searched for my hero academia,2018-10-14T12:09:03.963Z,
Searched for my hero academia,2018-10-14T11:27:22.106Z,
Searched for how to be productive,2018-10-13T14:19:30.478Z,
Searched for how to replace Bluetooth headphones pads,2018-10-13T08:16:13.226Z,
Searched for boat rockerz 400 repair,2018-10-13T08:15:47.431Z,
Searched for you say run,2018-10-13T06:34:45.346Z,
Searched for poco f1 durability test,2018-10-13T05:11:47.727Z,
Searched for hande ercel,2018-10-12T16:52:57.811Z,
Searched for bass,2018-10-12T16:34:02.511Z,
Searched for my hero academia,2018-10-12T16:17:20.947Z,
Searched for Simla Mirchi Ka salan,2018-10-11T15:01:06.399Z,
Searched for shimla mirch ka salan,2018-10-11T15:00:51.425Z,
Searched for oneplus 5 update,2018-10-11T13:59:51.201Z,
Searched for interstellar soundtrack,2018-10-11T11:28:59.397Z,
Searched for hande ercel,2018-10-11T11:27:21.354Z,
Searched for hande,2018-10-11T11:27:06.109Z,
Searched for interstellar soundtrack,2018-10-11T03:30:17.250Z,
Searched for z2 play,2018-10-11T02:41:45.435Z,
Searched for oneplus 5 teardown,2018-10-11T02:18:23.624Z,
Searched for oneplus 5,2018-10-11T02:18:13.463Z,
Searched for oneplus 5,2018-10-10T13:06:52.957Z,
Searched for OnePlus 5,2018-10-10T09:52:32.136Z,
Searched for how to not get bored while studying,2018-08-08T15:29:07.362Z,
Searched for how to not get boor while studying,2018-08-08T15:29:04.043Z,
Searched for how to make a multi core app work good on quad core cpu,2018-08-08T15:23:20.988Z,
Searched for almighty,2018-08-08T15:22:13.507Z,
Searched for you say run best,2018-08-08T15:20:43.093Z,
Searched for almighty smash,2018-08-08T15:09:57.463Z,
Searched for boku no hero best moments,2018-08-07T14:32:38.249Z,
Searched for boku no hero,2018-08-07T14:32:16.924Z,
Searched for naruto sad soundtrack remix,2018-08-07T13:07:13.063Z,
Searched for naruto sad soundtrack,2018-08-07T13:06:45.722Z,
Searched for attack on titan season 3 episode 3,2018-08-06T05:42:34.538Z,
Searched for attack on titan season 3,2018-08-06T05:42:31.096Z,
Searched for OnePlus 3 battery,2018-08-05T18:55:48.766Z,
Searched for OnePlus 3,2018-08-05T18:46:39.626Z,
Searched for attack on titan season 3 episode 3,2018-08-05T12:25:56.406Z,
Searched for attack on titan season 3,2018-08-05T12:23:17.452Z,
Searched for jetta radiator fan not working,2018-08-05T07:52:34.762Z,
Searched for mi 8 jerry rig everything,2018-08-05T06:09:18.040Z,
Searched for boku no hero academia season 3 episode 17,2018-08-04T10:24:39.097Z,
Searched for boku no hero academia season 3 episode 16,2018-08-04T10:23:27.150Z,
Searched for boku no hero academia season 3 episode 15,2018-08-04T10:22:21.615Z,
Searched for boku no hero academia season 3 episode 14,2018-08-04T10:22:02.498Z,
Searched for boku no hero academia season 3 episode 13,2018-08-04T10:21:54.891Z,
Searched for pubg in oneplus 3,2018-08-03T14:24:22.658Z,
Searched for boruto episode 67,2018-08-02T12:04:00.154Z,
Searched for boruto episode 75,2018-08-02T11:54:04.541Z,
Searched for boruto episode 68,2018-08-02T11:49:59.384Z,
Searched for oneplus 3 vs redmi note 5 pro speed,2018-08-02T08:37:15.728Z,
Searched for oneplus 3 vs redmi note 5 pro,2018-08-02T08:37:07.476Z,
Searched for note 5 pro vs OnePlus 3,2018-08-02T08:17:27.018Z,
Searched for note 5 pro review,2018-08-02T07:54:37.103Z,
Searched for pixel in 2018,2018-08-02T06:18:36.685Z,
Searched for how to lose weight,2018-08-02T04:23:17.127Z,
Searched for low carbon food,2018-08-02T04:18:07.530Z,
Searched for blue bird,2018-08-01T05:34:10.387Z,
Searched for assassin's creed,2018-07-03T09:48:08.588Z,
Searched for assassin's creed knife mechanism,2018-07-03T08:47:26.893Z,
Searched for assassin's creed mechanism,2018-07-03T08:47:11.844Z,
Searched for assassin's creed,2018-07-03T08:47:07.038Z,
Searched for sonic boom,2018-07-03T04:55:56.262Z,
Searched for bullet train,2018-07-03T04:53:15.148Z,
Searched for boku no hero academia season 3 episode 13,2018-06-30T16:26:52.506Z,
Searched for boku no hero academia season 3 episode 13,2018-06-30T09:46:01.150Z,
Searched for boku no hero academia season 3 episode 12,2018-06-30T09:45:16.491Z,
Searched for boku no hero academia season 3 episode 11,2018-06-30T09:44:46.147Z,
Searched for boku no hero academia season 3 episode 10,2018-06-30T09:44:31.606Z,
Searched for gon resolve,2018-06-30T04:22:54.800Z,
Searched for gon,2018-06-30T04:21:59.794Z,
Searched for boruto episode 63,2018-06-28T14:35:35.567Z,
Searched for how to open activa front wheel puncher,2018-06-28T06:37:16.816Z,
Searched for how to open activa front wheel,2018-06-28T06:36:53.088Z,
Searched for blue bird,2018-06-28T03:18:36.706Z,
Searched for blue,2018-06-28T03:18:26.044Z,
Searched for blue bird,2018-06-27T14:32:55.371Z,
Searched for cat,2018-06-27T10:58:48.170Z,
Searched for thunder,2018-06-27T10:27:52.820Z,
Searched for hunter gon takes his eyes,2018-06-27T07:49:33.808Z,
Searched for bluebird christina perri,2018-06-27T05:29:50.794Z,
Searched for blue bird,2018-06-27T05:27:19.400Z,
Searched for chibaku tensei,2018-06-25T16:57:46.880Z,
Searched for cibaku,2018-06-25T16:57:35.889Z,
Searched for cibwku,2018-06-25T16:57:31.653Z,
Searched for shutter speed,2018-06-24T16:12:45.470Z,
Searched for s9 plus aperture,2018-06-24T16:06:23.387Z,
Searched for s9 plus,2018-06-24T16:06:05.156Z,
Searched for blue bird,2018-06-24T15:40:51.741Z,
Searched for blue bird,2018-06-24T10:10:07.115Z,
Searched for j6 review,2018-06-24T08:21:57.865Z,
Searched for j6,2018-06-24T08:21:32.337Z,
Searched for my hero academia season 3 episode 12,2018-06-24T08:05:15.094Z,
Searched for my hero academia season 3 episode 10,2018-06-24T07:58:52.549Z,
Searched for boruto episode 63,2018-06-22T17:43:00.287Z,
Searched for boruto episode 62,2018-06-22T17:42:51.828Z,
Searched for cinematic trailer,2018-06-21T15:27:55.368Z,
Searched for cinematic trailee,2018-06-21T15:27:51.144Z,
Searched for hyper adaptive,2018-06-21T12:56:36.157Z,
Searched for best budget sport shoes pune,2018-06-21T12:52:47.302Z,
Searched for best budget sport shoes,2018-06-21T12:51:43.769Z,
Searched for best budget shoes,2018-06-21T12:51:12.379Z,
Searched for hrx shoes review,2018-06-21T12:33:16.963Z,
Searched for shoto,2018-06-21T10:19:06.988Z,
Searched for top rising moment,2018-06-21T09:51:42.268Z,
Searched for boruto episode 63,2018-06-21T09:49:08.501Z,
Searched for best running unisex shoes india,2018-06-21T04:47:51.794Z,
Searched for best running unisex shoes,2018-06-21T04:47:43.920Z,
Searched for how to use astringent,2018-06-20T15:13:34.302Z,
Searched for bb ki vines,2018-06-19T15:14:27.158Z,
Searched for Samsung,2018-06-19T11:59:31.113Z,
Searched for samsung under 10000,2018-06-19T11:54:55.784Z,
Searched for bb ki vines best,2018-06-19T03:25:15.450Z,
Searched for bb ki vines best,2018-06-18T17:44:10.961Z,
Searched for bb ki vines,2018-06-18T17:38:08.240Z,
Searched for OnePlus 3 vs zuk z2,2018-06-18T12:48:12.894Z,
Searched for OnePlus 3 vs zuk z1,2018-06-18T12:48:12.394Z,
Searched for songs 2018,2018-06-18T08:54:07.316Z,
Searched for spider telgu,2018-06-18T05:08:04.674Z,
Searched for spider,2018-06-18T05:05:57.467Z,
Searched for Google pixel  vs OnePlus 3,2018-06-17T17:04:13.886Z,
Searched for OnePlus 3 open beta 38,2018-06-17T14:58:37.760Z,
Searched for OnePlus 3 open beta,2018-06-17T14:57:20.382Z,
Searched for how to apply charcoal mask,2018-06-15T17:16:53.633Z,
Searched for boruto episode 62,2018-06-14T11:54:33.833Z,
Searched for boruto episode 62,2018-06-14T11:19:54.491Z,
Searched for zero,2018-06-14T09:50:20.219Z,
Searched for boruto episode 62,2018-06-14T09:47:47.976Z,
Searched for which shoes to wear with jeans,2018-06-13T18:24:48.407Z,
Searched for midoriya saves uraraka,2018-06-13T11:32:50.984Z,
Searched for migi moments,2018-06-12T17:34:15.682Z,
Searched for ging in meeting,2018-06-12T17:18:20.276Z,
Searched for gons resolve,2018-06-12T15:23:39.296Z,
Searched for gons resolve,2018-06-12T12:38:08.557Z,
Searched for maulana Tariq Jameel keena,2018-06-10T23:48:01.075Z,
Searched for moulana Tariq Jamel keena,2018-06-10T23:47:45.324Z,
Searched for moulana Tariq Jameel kina,2018-06-10T23:46:10.291Z,
Searched for bokus aur kina,2018-06-10T23:45:34.585Z,
Searched for lineage os 15.1 oneplus 3,2018-06-09T17:48:24.856Z,
Searched for lineageos 15.1,2018-06-09T17:48:20.005Z,
Searched for boku no hero academia season 3 episode 10,2018-06-09T12:04:41.585Z,
Searched for mechanical engineer jobs in india,2018-06-09T05:46:42.841Z,
Searched for civil engineering,2018-06-08T12:54:06.461Z,
Searched for hunter x hunter music theme,2018-06-07T23:20:32.446Z,
Searched for hunter x hunter rising music,2018-06-07T23:19:54.079Z,
Searched for hunter x hunter music,2018-06-07T23:17:51.629Z,
Searched for hunter netero bomb,2018-06-07T06:42:44.138Z,
Searched for netro self distructio,2018-06-07T06:42:11.192Z,
Searched for chicken masala,2018-06-05T12:45:23.041Z,
Searched for magisk modules,2018-06-05T12:27:42.616Z,
Searched for spidish,2018-06-04T16:57:00.617Z,
Searched for spiddish,2018-06-04T16:54:44.674Z,
Searched for spiddush,2018-06-04T16:54:36.822Z,
Searched for chibaku tensei,2018-06-04T13:22:07.760Z,
Searched for Deadpool 2,2018-06-04T12:51:28.091Z,
Searched for naruto music,2018-05-19T15:08:46.885Z,
Searched for boruto,2018-05-18T09:10:47.667Z,
Searched for borutp,2018-05-18T09:10:44.066Z,
Searched for oneplus 6 vs samsung s9 speed,2018-05-18T01:10:22.544Z,
Searched for oneplus 6 vs samsung s9,2018-05-18T01:09:01.934Z,
Searched for oneplus 6 launch event,2018-05-18T00:38:16.783Z,
Searched for 4k,2017-12-17T04:11:11.831Z,
Searched for best naat in the world,2017-12-17T03:50:36.068Z,
Searched for Dadi Amma,2017-12-17T03:48:16.875Z,
Searched for Nagamma manager,2017-12-17T03:48:08.533Z,
Searched for 4K samsung,2017-12-17T03:40:52.701Z,
Searched for 4K,2017-12-17T03:39:44.479Z,
Searched for 4k,2017-12-16T10:04:39.413Z,
