title,time,details
Searched for why do we fast in muharram,2019-09-09T00:53:22.979Z,
Searched for how to build watch dogs bot,2019-09-08T18:34:29.502Z,
Searched for how to build watch dogs,2019-09-08T18:33:09.117Z,
Searched for best budget laptop,2019-09-08T15:39:40.413Z,
Searched for watch dogs 2 full running download,2019-09-08T15:33:28.072Z,
Searched for watch dogs 2 crash fix,2019-09-08T14:30:29.454Z,
Searched for pixel 2 beta,2019-09-07T18:35:06.059Z,
Searched for pixel 2 xl,2019-09-07T17:55:07.306Z,
Searched for pixel 2,2019-09-07T17:54:22.230Z,
Searched for pixel 2 beta,2019-09-07T17:54:04.893Z,
Searched for pixel 2 android q,2019-09-07T17:52:08.504Z,
Searched for OnePlus 5,2019-09-07T17:25:50.516Z,
Searched for wifi packets through android,2019-09-07T16:42:09.428Z,
Searched for wifi packets,2019-09-07T16:30:56.305Z,
Searched for how to scan wifi signals through phone,2019-09-07T16:30:18.818Z,
Searched for realme 5 pro vs pixel 2,2019-09-07T07:10:12.363Z,
Searched for realme 5 pro vs,2019-09-07T07:10:03.953Z,
Searched for realme 5 pro,2019-09-07T06:53:38.778Z,
Searched for under 15000 best phone 2019,2019-09-07T06:46:55.957Z,
Searched for pixel 2 vs,2019-09-06T19:02:40.992Z,
Searched for google pixel 2,2019-09-06T18:58:17.769Z,
Searched for pixel 2,2019-09-06T18:52:59.588Z,
Searched for pixel 2 in 2019,2019-09-06T18:52:32.446Z,
Searched for pixel 2 xl in 2019,2019-09-06T18:52:27.440Z,
Searched for #hardwarecanucks,2019-09-06T18:47:00.235Z,
Searched for curta calculator,2019-09-06T18:02:19.827Z,
Searched for pixel 2 vs oneplus 5,2019-09-06T16:41:19.404Z,
Searched for watch dogs 2 crashing at island,2019-09-06T16:15:33.155Z,
Searched for watch dogs 2 quadcopter,2019-09-06T14:41:16.558Z,
Searched for watch dogs 2 hacking laptop,2019-09-06T14:40:04.370Z,
Searched for watch dogs 2 crashing at island,2019-09-06T14:39:31.325Z,
Searched for itachi,2019-09-06T10:54:03.030Z,
Searched for dheeme dheeme,2019-09-06T10:51:56.888Z,
Searched for watch dogs 2 crashing at island,2019-09-05T17:54:44.449Z,
Searched for how to get rid of helicopter in watch dog 2 without,2019-09-04T16:17:26.627Z,
Searched for application run size tool,2019-09-04T14:47:55.618Z,
Searched for watch dogs 2 crashing during gameplay,2019-09-04T14:22:56.018Z,
Searched for watch dogs,2019-09-04T04:14:10.414Z,
Searched for watch dogs 2 crashing during gameplay,2019-09-03T16:55:23.211Z,
Searched for watch dogs 2 not running smoothly,2019-09-03T15:54:19.800Z,
Searched for 3d song,2019-09-03T12:52:47.050Z,
Searched for r,2019-09-03T12:51:01.233Z,
Searched for how to solder the earphone wire,2019-09-03T10:49:19.259Z,
Searched for how to solder the speaker wire,2019-09-03T10:48:55.374Z,
Searched for thugs of hindustan in a nutshell yogi baba,2019-09-03T09:48:06.492Z,
Searched for baba,2019-09-03T09:17:26.690Z,
Searched for pachtaoge song,2019-09-03T06:41:08.306Z,
Searched for 3 axis gimbal,2019-09-02T15:53:05.384Z,
Searched for how to open a studd visor,2019-09-02T07:16:47.097Z,
Searched for revolt rv 400 0-60,2019-08-31T17:52:36.385Z,
Searched for revolt,2019-08-31T17:51:56.266Z,
Searched for revolt,2019-08-31T16:10:17.913Z,
Searched for a silent voice,2019-08-30T15:45:21.620Z,
Searched for naruto sad,2019-08-30T10:42:22.081Z,
Searched for zaheer,2019-08-30T10:37:56.484Z,
Searched for bad teacher,2019-08-29T13:22:58.054Z,
Searched for teacher gets pregnant,2019-08-29T13:22:47.993Z,
Searched for how to opendoor in watch dogs 2,2019-08-29T12:13:11.710Z,
Searched for weighted point method for material selection,2019-08-29T06:41:59.660Z,
Searched for watch dogs,2019-08-28T10:23:10.831Z,
Searched for bioshock infinite,2019-08-27T18:20:55.650Z,
Searched for cyberpunk,2019-08-27T15:02:52.086Z,
Searched for des ex,2019-08-27T14:48:54.060Z,
Searched for watchdog 2,2019-08-27T12:04:37.265Z,
Searched for jiyein kyun mtv unplugged,2019-08-27T10:59:52.483Z,
Searched for jiyein kyun dance,2019-08-27T10:58:24.546Z,
Searched for jiyein kyun,2019-08-27T10:58:16.997Z,
Searched for jiyen kyun,2019-08-27T10:57:58.263Z,
Searched for parasite maximum,2019-08-27T10:35:16.675Z,
Searched for parasite,2019-08-27T10:31:54.238Z,
Searched for bullying wrong girl anime,2019-08-27T09:38:03.870Z,
Searched for bullying wrong girl,2019-08-27T09:37:20.565Z,
Searched for pachtaoge song,2019-08-27T09:31:38.008Z,
Searched for studds d7,2019-08-27T03:37:44.604Z,
Searched for naruto sad,2019-08-26T18:33:46.434Z,
Searched for hagemaru song,2019-08-26T12:46:02.385Z,
Searched for shinchan in hindi intro song,2019-08-26T12:44:43.889Z,
Searched for shinchan in hindi,2019-08-26T12:44:38.660Z,
Searched for perman intro song,2019-08-26T12:42:36.414Z,
Searched for perman song,2019-08-26T12:42:21.704Z,
Searched for perman,2019-08-26T12:41:45.927Z,
Searched for permab,2019-08-26T12:41:43.249Z,
Searched for undersea game,2019-08-26T11:41:08.291Z,
Searched for under,2019-08-26T11:41:04.066Z,
Searched for kenny vs levi,2019-08-26T11:21:29.382Z,
Searched for gta 5 money unlimited,2019-08-26T08:55:34.540Z,
Searched for gta 5 money glitch,2019-08-26T08:54:06.367Z,
Searched for note 10 plus vs oneplus 7 pro,2019-08-25T17:58:15.519Z,
Searched for madara,2019-08-25T07:21:16.898Z,
Searched for naruto vs sasuke,2019-08-25T03:39:16.817Z,
Searched for watch dog,2019-08-24T10:47:47.208Z,
Searched for ending phineas and ferb,2019-08-24T10:12:40.032Z,
Searched for ending phenus and ferb,2019-08-24T10:12:06.254Z,
Searched for what you doing pheneus,2019-08-24T10:10:58.611Z,
Searched for what you doing,2019-08-24T10:09:59.725Z,
Searched for isabella,2019-08-24T10:09:00.978Z,
Searched for radial piston motor,2019-08-23T11:55:31.046Z,
Searched for here with me,2019-08-23T11:35:55.856Z,
Searched for naruto fights,2019-08-23T10:17:06.601Z,
Searched for how to swim up in gta 5,2019-08-23T07:06:39.893Z,
Searched for this is why you wear a helmet,2019-08-23T06:14:06.734Z,
Searched for saiyaan psycho,2019-08-23T05:22:15.111Z,
Searched for how does a solar system form,2019-08-23T04:49:04.268Z,
Searched for india road accident,2019-08-22T19:20:45.906Z,
Searched for indai road accident,2019-08-22T18:52:47.890Z,
Searched for this why you should wear helmet,2019-08-22T18:52:20.552Z,
Searched for this why you should wear helmet,2019-08-22T18:21:05.610Z,
Searched for isi helmet vs truck,2019-08-22T18:07:50.185Z,
Searched for isi helmet testing,2019-08-22T18:02:20.364Z,
Searched for naruto sorrow and sadness,2019-08-22T17:42:11.464Z,
Searched for naruto,2019-08-22T17:41:55.356Z,
Searched for best bike in india,2019-08-22T15:14:08.237Z,
Searched for how to remove thunder visor,2019-08-22T12:45:05.879Z,
Searched for naruto remix,2019-08-21T11:51:17.014Z,
Searched for studds thunder,2019-08-20T16:37:09.365Z,
Searched for udd gaye,2019-08-19T10:42:12.089Z,
Searched for studds vs steelbird,2019-08-18T18:05:15.751Z,
Searched for shippiden  episode 310,2019-08-18T15:37:14.055Z,
Searched for parasite heals migi,2019-08-18T14:04:06.558Z,
Searched for parasite heals,2019-08-18T14:03:57.290Z,
Searched for naruto vs nagato,2019-08-18T13:31:39.605Z,
Searched for naruto vs pain ending,2019-08-18T13:30:33.586Z,
Searched for jiraiya removes naruto's seal,2019-08-18T13:13:19.382Z,
Searched for how tight should your helmet be,2019-08-18T12:40:38.165Z,
Searched for how to check activa chassis number,2019-08-18T11:00:42.410Z,
Searched for how to remove visor,2019-08-18T10:48:05.822Z,
Searched for naruto remix,2019-08-18T05:36:23.834Z,
Searched for calm,2019-08-17T18:35:15.348Z,
Searched for rain song,2019-08-17T18:32:03.080Z,
Searched for wake up,2019-08-17T18:21:53.099Z,
Searched for wke up,2019-08-17T18:21:50.806Z,
Searched for interstellar music,2019-08-17T18:20:06.081Z,
Searched for interstellar,2019-08-17T18:19:57.377Z,
Searched for naruto violin,2019-08-17T18:19:37.076Z,
Searched for naruto voilin,2019-08-17T18:15:49.270Z,
Searched for single tune,2019-08-17T18:14:30.552Z,
Searched for motivation,2019-08-17T18:11:58.537Z,
Searched for mood,2019-08-17T18:10:10.547Z,
Searched for korra music,2019-08-17T17:46:08.062Z,
Searched for hercules animated,2019-08-17T11:00:49.686Z,
Searched for zeus fight scene,2019-08-17T10:54:06.053Z,
Searched for most powerful bender,2019-08-17T10:51:28.013Z,
Searched for most poweful bender,2019-08-17T10:41:25.890Z,
Searched for boom boom man,2019-08-17T10:35:10.925Z,
Searched for pli moment,2019-08-17T10:34:48.198Z,
Searched for zaheer girlfriend death,2019-08-17T10:28:51.480Z,
Searched for zaheer,2019-08-17T10:16:23.747Z,
Searched for iroh firebending,2019-08-17T10:12:09.335Z,
Searched for iroh,2019-08-17T10:11:55.269Z,
Searched for zuko vs ozai,2019-08-17T10:05:57.297Z,
Searched for toph vs aang,2019-08-17T09:58:28.492Z,
Searched for aang vs toph,2019-08-17T09:58:13.044Z,
Searched for aang final fight,2019-08-17T09:52:59.197Z,
Searched for aang best fight,2019-08-17T09:52:28.104Z,
Searched for aang fight,2019-08-17T09:52:25.987Z,
Searched for aang vs,2019-08-17T08:42:32.745Z,
Searched for how are specs made,2019-08-17T06:27:36.521Z,
Searched for motivation,2019-08-16T16:26:20.588Z,
Searched for epyc,2019-08-16T15:45:18.882Z,
Searched for tpty,2019-08-16T15:45:12.380Z,
Searched for cpvc,2019-08-16T15:45:04.944Z,
Searched for impact theory motivation,2019-08-15T18:25:54.989Z,
Searched for motivation,2019-08-15T18:23:43.065Z,
Searched for motivation dream,2019-08-15T18:09:53.918Z,
Searched for riddle ted,2019-08-15T18:02:43.352Z,
Searched for riddle,2019-08-15T18:02:30.205Z,
Searched for apna elaj apne hath,2019-08-15T15:30:46.969Z,
Searched for aang vs toph full fight,2019-08-15T12:47:05.163Z,
Searched for mithun chakraborty movies full,2019-08-15T12:44:12.361Z,
Searched for iladhar swami,2019-08-15T12:44:01.845Z,
Searched for mithun chakraborty in omg,2019-08-15T12:40:16.131Z,
Searched for radhe ma,2019-08-15T12:39:09.680Z,
Searched for o my god real life,2019-08-15T12:38:50.282Z,
Searched for o my god real life story,2019-08-15T12:38:27.921Z,
Searched for wwe motivation,2019-08-15T10:15:00.315Z,
Searched for what are you waiting for motivation,2019-08-15T10:12:51.586Z,
Searched for what are you eating for motivation,2019-08-15T10:12:35.573Z,
Searched for motivational stories by sandeep maheshwari,2019-08-15T10:02:46.638Z,
Searched for motivational stories,2019-08-15T09:37:11.763Z,
Searched for motivational whatsapp status,2019-08-15T09:36:59.486Z,
Searched for dog butchering,2019-08-15T07:31:16.765Z,
Searched for camel qurbani gone wrong,2019-08-15T07:27:13.792Z,
Searched for camel qurbani,2019-08-15T07:21:54.871Z,
Searched for cattle butchering,2019-08-15T07:20:02.634Z,
Searched for chicken Kaise katte,2019-08-15T07:17:30.393Z,
Searched for how to cut a chicken,2019-08-15T07:17:19.929Z,
Searched for qurbani goat,2019-08-15T06:59:16.882Z,
Searched for qurbani,2019-08-15T06:59:08.188Z,
Searched for bakra chilna,2019-08-15T06:51:06.052Z,
Searched for mutton biryani shadi,2019-08-15T06:49:24.190Z,
Searched for mutton biryani,2019-08-15T06:48:43.504Z,
Searched for sba 1 vs shifter,2019-08-14T16:55:51.305Z,
Searched for sba 1,2019-08-14T16:32:56.967Z,
Searched for sba 1 vs sba 2,2019-08-14T15:58:28.114Z,
Searched for helmet,2019-08-14T15:55:48.891Z,
Searched for motivation,2019-08-13T15:41:46.271Z,
Searched for Senorita,2019-08-13T12:07:27.736Z,
Searched for xxxtentacion Jocelyn,2019-08-13T09:49:33.420Z,
Searched for xxxtentacion moonlight amv,2019-08-13T09:49:22.330Z,
Searched for xxxtentacion moonlight,2019-08-13T09:48:19.471Z,
Searched for xxxtentacion i spoke to the devil in miami he said everything would be fine,2019-08-13T09:46:55.882Z,
Searched for guy vs madara,2019-08-13T09:15:34.217Z,
Searched for lemonade beyonce,2019-08-13T09:08:46.116Z,
Searched for madara vs hashirama,2019-08-13T08:14:59.652Z,
Searched for iroh,2019-08-13T08:01:33.169Z,
Searched for naruto vs pain,2019-08-13T07:14:37.058Z,
Searched for pixel 4,2019-08-13T06:39:42.648Z,
Searched for piya aao to mande ri baat kar liya,2019-08-13T06:39:36.183Z,
Searched for alone motivation,2019-08-12T17:49:52.508Z,
Searched for #Comedy,2019-08-11T19:26:13.451Z,
Searched for #StandUpComedy,2019-08-11T19:26:08.200Z,
Searched for #Rains,2019-08-11T19:26:01.086Z,
Searched for how to get rid of mosquitoes,2019-08-11T18:46:18.515Z,
Searched for toph best,2019-08-11T16:25:34.946Z,
Searched for toph best,2019-08-11T12:31:29.232Z,
Searched for what is cylindrical power of eye,2019-08-10T08:33:42.087Z,
Searched for amd,2019-08-10T04:42:05.071Z,
Searched for naruto speech,2019-08-08T17:42:51.634Z,
Searched for maruto speech,2019-08-08T17:42:49.463Z,
Searched for pixel 2,2019-08-08T17:29:58.971Z,
Searched for motivation,2019-08-08T17:29:26.902Z,
Searched for a30,2019-08-08T15:17:32.647Z,
Searched for a50 water test,2019-08-08T15:11:25.982Z,
Searched for S8,2019-08-08T14:48:19.575Z,
Searched for oneplus 7 pro vs samsung s10 plus speed test,2019-08-08T11:00:03.546Z,
Searched for note 10 plus vs oneplus 7 pro,2019-08-08T10:56:17.531Z,
Searched for note 10 vs oneplus 7 pro,2019-08-08T10:56:05.655Z,
Searched for interstellar,2019-08-07T18:22:57.070Z,
Searched for interstellar music,2019-08-07T18:22:54.107Z,
Searched for motivation,2019-08-07T18:14:34.427Z,
Searched for never give up,2019-08-07T18:11:48.704Z,
Searched for never give up naruto,2019-08-07T18:01:56.189Z,
Searched for mever give up,2019-08-07T18:00:54.104Z,
Searched for mever give up batman,2019-08-07T17:59:41.825Z,
Searched for road fury music,2019-08-07T17:43:36.807Z,
Searched for road fury,2019-08-07T17:42:57.139Z,
Searched for bahubali song,2019-08-07T17:41:54.372Z,
Searched for song,2019-08-07T17:41:40.983Z,
Searched for friends janice,2019-08-07T16:33:31.364Z,
Searched for friends janice and joey,2019-08-07T16:33:27.508Z,
Searched for jenice friends,2019-08-07T16:33:23.882Z,
Searched for jenifer friends,2019-08-07T16:33:09.726Z,
Searched for jenifer,2019-08-07T16:32:51.477Z,
Searched for stand up,2019-08-07T16:22:53.544Z,
Searched for awesome,2019-08-07T16:00:14.885Z,
Searched for pixel 2 vs pixel 3a,2019-08-07T11:25:46.507Z,
Searched for pixel 2,2019-08-07T11:18:49.988Z,
Searched for pixel 2 vs oneplus 5,2019-08-07T11:17:48.798Z,
Searched for legend of korra ending theme piano,2019-08-07T11:04:23.541Z,
Searched for avatar korra ending music,2019-08-07T11:02:21.192Z,
Searched for k20,2019-08-07T09:22:11.569Z,
Searched for f11 pro vs realme 3 pro,2019-08-07T09:03:07.612Z,
Searched for f11 pro,2019-08-07T08:54:28.844Z,
Searched for f11 pro vs oneplus 6,2019-08-07T08:52:24.635Z,
Searched for how toghf changed avatar,2019-08-07T04:34:45.945Z,
Searched for how toh changed avatar,2019-08-07T04:34:35.943Z,
Searched for how togh changed avatarr,2019-08-07T04:34:20.490Z,
Searched for avatar korra ending music remix,2019-08-06T18:33:07.207Z,
Searched for avatar korra ending music,2019-08-06T18:32:36.248Z,
Searched for avatar korra music,2019-08-06T05:16:11.955Z,
Searched for avatar korra ending music,2019-08-06T05:14:50.435Z,
Searched for why avatar korra ending music,2019-08-05T17:10:21.290Z,
Searched for avatar korra ending music,2019-08-05T17:09:56.883Z,
Searched for dheeme dheeme,2019-08-04T12:31:09.118Z,
Searched for how to accept your failure,2019-08-04T11:47:17.387Z,
Searched for avatar guru,2019-08-04T11:27:19.658Z,
Searched for avatar furu,2019-08-04T11:27:09.180Z,
Searched for one punch man season 3 date,2019-08-04T07:56:01.432Z,
Searched for one punch man season 3,2019-08-04T07:55:42.332Z,
Searched for oneplunch man season 3,2019-08-04T07:55:38.903Z,
Searched for when will attack on titan season 4 come out,2019-08-04T07:54:18.507Z,
Searched for katara in legend of korra,2019-08-04T07:27:33.767Z,
Searched for katara dies in legend of korra,2019-08-04T07:26:55.725Z,
Searched for zuko in legend of korra,2019-08-04T07:25:39.435Z,
Searched for zuko,2019-08-04T06:46:52.937Z,
Searched for Mexico City,2019-08-01T05:27:48.979Z,
Searched for train dampers working,2019-07-31T07:35:35.854Z,
Searched for who is paying beast boy,2019-07-31T04:12:15.010Z,
Searched for who is paying garfield,2019-07-31T04:11:55.363Z,
Searched for download essentialism,2019-07-30T19:16:10.547Z,
Searched for OnePlus 5,2019-07-30T17:16:27.776Z,
Searched for dheeme,2019-07-30T14:52:33.709Z,
Searched for moto z2 ambient display,2019-07-30T14:36:59.224Z,
Searched for moto z2 active display,2019-07-30T14:34:18.887Z,
Searched for moto z2 ative display,2019-07-30T14:34:15.351Z,
Searched for moto z2 wake up,2019-07-30T14:32:56.267Z,
Searched for z2 wake up,2019-07-30T14:32:45.232Z,
Searched for basanti no dance,2019-07-30T14:18:38.689Z,
Searched for bear modi,2019-07-30T10:39:57.318Z,
Searched for midoriya,2019-07-30T08:37:06.332Z,
Searched for midlriya,2019-07-30T08:37:04.136Z,
Searched for kunal,2019-07-30T08:32:03.747Z,
Searched for modi vs bear grylls,2019-07-30T08:31:55.532Z,
Searched for spider man into the spider verse,2019-07-30T08:20:46.423Z,
Searched for spider man into the spider verse review,2019-07-30T08:20:38.996Z,
Searched for pixel,2019-07-30T03:16:26.903Z,
Searched for jake and amy,2019-07-29T14:23:44.244Z,
Searched for mel robbins impact theory,2019-07-29T13:23:35.390Z,
Searched for mel robins,2019-07-29T13:23:21.278Z,
Searched for mel robbins ted talk,2019-07-28T17:46:34.824Z,
Searched for mel robins,2019-07-28T17:46:14.278Z,
Searched for .el robins,2019-07-28T17:46:05.097Z,
Searched for motivation impac,2019-07-28T17:37:12.119Z,
Searched for motivation,2019-07-28T17:37:01.604Z,
Searched for simon sinek impact,2019-07-28T17:24:48.461Z,
Searched for simon sinek,2019-07-28T17:24:44.350Z,
Searched for simon sinek on motivationmadness,2019-07-28T17:24:23.322Z,
Searched for simon sinek on motivation,2019-07-28T17:24:03.223Z,
Searched for motivation madness,2019-07-28T17:22:59.870Z,
Searched for motivation,2019-07-28T15:48:58.796Z,
Searched for batman music,2019-07-28T15:48:10.490Z,
Searched for madmax music,2019-07-28T15:44:23.046Z,
Searched for madmax,2019-07-28T15:44:12.215Z,
Searched for batman gotham knight,2019-07-28T15:43:18.346Z,
Searched for batman in india,2019-07-28T15:29:30.516Z,
Searched for batman best motivation,2019-07-28T15:24:47.015Z,
Searched for aang vs firelord ozai full fight,2019-07-28T15:17:14.528Z,
Searched for aang vs,2019-07-28T15:16:48.916Z,
Searched for how to increase focus,2019-07-28T15:14:15.378Z,
Searched for barney and robin,2019-07-28T09:12:22.814Z,
Searched for stand up,2019-07-28T07:09:26.900Z,
Searched for a70,2019-07-28T04:46:03.645Z,
Searched for spider man into the spider verse review variant comic,2019-07-27T14:49:06.161Z,
Searched for spider man into the spider verse review,2019-07-27T14:48:33.972Z,
Searched for spider man into the spider verse,2019-07-27T14:48:26.012Z,
Searched for dheeme,2019-07-27T14:35:13.025Z,
Searched for tere do naina,2019-07-26T17:58:50.393Z,
Searched for ted,2019-07-25T15:12:47.139Z,
Searched for kunal,2019-07-24T10:34:17.601Z,
Searched for #StandupComedy,2019-07-24T10:21:50.336Z,
Searched for #India,2019-07-24T10:20:35.104Z,
Searched for stand up,2019-07-23T14:35:24.996Z,
Searched for how to reduce stress,2019-07-23T14:26:57.746Z,
Searched for sunflower,2019-07-22T18:05:50.759Z,
Searched for Innocent,2019-07-22T18:05:41.641Z,
Searched for Kuvira full robot,2019-07-21T06:16:34.646Z,
Searched for Simon sinek 2019,2019-07-21T05:37:21.284Z,
Searched for Simon sinek,2019-07-21T05:37:16.993Z,
Searched for How to make fried rice,2019-07-20T14:41:14.689Z,
Searched for How to make fried,2019-07-20T14:41:09.194Z,
Searched for gotham by gaslight,2019-07-20T10:44:07.292Z,
Searched for Hp laser jet giving faded print,2019-07-20T07:39:36.550Z,
Searched for Hp laser jet giving faded print,2019-07-20T07:03:24.069Z,
Searched for Mi a3,2019-07-20T06:54:59.423Z,
Searched for Hp laserjet 1022 laser unit,2019-07-20T06:31:14.347Z,
Searched for Hp laserjet 1022 light print,2019-07-20T06:31:12.036Z,
Searched for Hp laserjet 1022 laser unit,2019-07-20T05:50:53.908Z,
Searched for Hp laserjet 1022,2019-07-20T05:44:22.731Z,
Searched for Hp laser printer 1022 one side light,2019-07-20T04:51:30.236Z,
Searched for stand up,2019-06-13T06:17:15.685Z,
Searched for stanup,2019-06-13T06:17:13.122Z,
Searched for best,2019-06-13T06:17:02.954Z,
Searched for standup,2019-06-13T04:25:09.107Z,
Searched for road to the jungle,2019-06-12T17:50:38.730Z,
Searched for batman vs zoom,2019-06-12T15:11:06.923Z,
Searched for techibee,2019-06-12T02:01:49.514Z,
Searched for kunal,2019-06-10T17:10:22.716Z,
Searched for standup,2019-06-10T17:10:01.813Z,
Searched for alvin lalduhawma,2019-06-08T04:00:31.387Z,
Searched for alvind,2019-06-08T04:00:21.429Z,
Searched for korra best fights,2019-06-07T18:21:15.160Z,
Searched for activa 125 body guard,2019-06-07T15:27:57.234Z,
Searched for one punch man season 2 episode 9,2019-06-06T01:14:03.323Z,
Searched for aang vs zaheer,2019-06-05T08:11:52.126Z,
Searched for activa diggi open without key,2019-06-04T15:15:59.573Z,
Searched for prototype,2019-06-03T12:47:12.244Z,
Searched for shameless,2019-04-06T13:14:45.111Z,
Searched for pixel 3 vs huawei p30 pro,2019-04-06T12:20:27.155Z,
Searched for pixel vs huawei p30,2019-04-06T12:20:23.893Z,
Searched for durre shahwar,2019-04-06T07:44:55.804Z,
Searched for dude a shaver,2019-04-06T07:40:34.266Z,
Searched for do Rochelle,2019-04-06T07:40:24.561Z,
Searched for gully boy parody,2019-04-06T05:30:25.670Z,
Searched for gully boy,2019-04-06T05:30:14.357Z,
Searched for how to calm your mind,2019-04-05T15:56:43.258Z,
Searched for little do you know,2019-04-05T15:46:33.988Z,
Searched for how to focus,2019-04-04T08:43:32.217Z,
Searched for young sheldon hallway touch,2019-04-03T16:37:29.486Z,
Searched for pixel 2 vs oneplus 5,2019-04-03T12:50:06.927Z,
Searched for pixel 2,2019-04-03T12:19:02.503Z,
Searched for I have a dream,2019-04-03T11:05:11.263Z,
Searched for bolt story,2019-04-03T09:57:39.718Z,
Searched for bolt stpry,2019-04-03T09:55:09.440Z,
Searched for Muhammad Ali speech,2019-04-02T14:48:41.506Z,
Searched for Muhammad Ali,2019-04-02T14:48:26.264Z,
Searched for motivation,2019-04-02T13:54:42.483Z,
Searched for motivation,2019-04-02T12:08:57.883Z,
Searched for bahut hard,2019-04-02T11:49:28.763Z,
Searched for chandler and ginger,2019-04-02T10:41:21.386Z,
Searched for joe jinger family,2019-04-02T10:41:03.524Z,
Searched for ginger joe,2019-04-02T10:40:48.864Z,
Searched for pixel 2 vs oneplus 5,2019-04-01T05:34:43.748Z,
Searched for bphon,2019-03-31T16:54:52.142Z,
Searched for chakra,2019-03-31T05:18:18.811Z,
Searched for how does tower fan work,2019-03-30T16:55:06.028Z,
Searched for how does an air cooler work without water,2019-03-30T16:51:52.282Z,
Searched for how does an air cooler work,2019-03-30T16:48:09.429Z,
Searched for how to love yourself,2019-03-30T16:40:03.534Z,
Searched for step up best dance scenes,2019-03-29T13:26:41.341Z,
Searched for axe boat party ad,2019-03-28T16:51:32.408Z,
Searched for azeem banatwalla,2019-03-28T16:49:14.935Z,
Searched for kamariya,2019-03-28T16:25:35.888Z,
Searched for chogada tara,2019-03-28T16:25:19.853Z,
Searched for hey mama,2019-03-28T16:12:01.429Z,
Searched for sunflower,2019-03-28T14:34:43.070Z,
Searched for sunflower,2019-03-28T11:53:14.635Z,
Searched for sunflower,2019-03-27T07:36:01.812Z,
Searched for sunflower,2019-03-27T02:46:02.813Z,
Searched for what up danger,2019-03-26T16:27:17.236Z,
Searched for sunflower,2019-03-26T16:06:20.876Z,
Searched for psychology,2019-03-24T16:53:01.644Z,
Searched for best earphones gaming,2019-03-24T10:19:14.673Z,
Searched for best earphones,2019-03-24T10:17:59.997Z,
Searched for what's up danger,2019-03-23T16:47:20.123Z,
Searched for inside quest,2019-03-23T05:13:59.433Z,
Searched for simon sinek,2019-03-23T05:13:38.687Z,
Searched for ted,2019-03-23T05:12:35.167Z,
Searched for all might best Singh,2019-03-21T12:23:52.353Z,
Searched for call my best scene,2019-03-21T12:23:44.424Z,
Searched for I am here,2019-03-21T12:23:13.959Z,
Searched for arigatou gozaimasu,2019-03-21T12:23:04.765Z,
Searched for kunal kamra,2019-03-21T10:32:13.990Z,
Searched for pm narendra modi trailer,2019-03-21T05:47:19.830Z,
Searched for modi trailer,2019-03-21T05:46:51.237Z,
Searched for modi,2019-03-21T05:46:42.564Z,
Searched for oneplus 5 vs note 7pro,2019-03-21T05:37:11.478Z,
Searched for oneplus 5 vs note 7pro,2019-03-20T05:05:02.206Z,
Searched for OnePlus 5 vs note 7pro,2019-03-20T05:04:01.811Z,
Searched for standup,2019-03-19T17:39:37.593Z,
Searched for ab kare to kare kya bole to bole kya,2019-03-19T14:55:32.334Z,
Searched for joe,2019-03-19T02:27:49.559Z,
Searched for Bluetooth keyless vehicle,2019-03-18T03:37:13.521Z,
Searched for bertha benz,2019-03-16T02:51:00.899Z,
Searched for lamberghini dance,2019-03-15T17:40:40.488Z,
Searched for Sheldon laughing,2019-03-15T17:04:06.677Z,
Searched for lele pons,2019-03-14T17:16:56.720Z,
Searched for redmi note 7 bend,2019-03-13T18:15:04.759Z,
Searched for redmi note 7,2019-03-13T18:14:51.584Z,
Searched for redmi note 7 bend,2019-03-13T06:57:37.008Z,
Searched for redmi note 7,2019-03-13T06:56:34.686Z,
Searched for believer song,2019-03-12T11:18:57.311Z,
Searched for believer song,2019-03-12T09:27:27.959Z,
Searched for rock songs,2019-03-12T09:26:34.219Z,
Searched for 3d lambergini,2019-03-12T09:23:55.517Z,
Searched for 3 d,2019-03-12T09:23:37.462Z,
Searched for shinichi become badass,2019-03-11T21:29:24.002Z,
Searched for tareefan,2019-03-11T20:35:01.831Z,
Searched for lamborghini,2019-03-11T04:52:07.415Z,
Searched for mad max best,2019-03-11T04:36:37.370Z,
Searched for king bach,2019-03-10T14:39:08.356Z,
Searched for kurapika vs spider,2019-03-10T14:00:39.644Z,
Searched for kurapika vs chrollo,2019-03-10T14:00:21.770Z,
Searched for chrollo lucilfer,2019-03-10T13:59:30.411Z,
Searched for chrollo lucilfer vs zoldyck,2019-03-10T13:51:26.035Z,
Searched for chorollo lucifer,2019-03-10T13:46:26.476Z,
Searched for gon vs jed,2019-03-10T13:07:51.245Z,
Searched for kurapika training,2019-03-10T12:50:32.059Z,
Searched for emiway,2019-03-10T05:42:59.696Z,
Searched for captain marvel post credit scene,2019-03-08T09:02:02.968Z,
